Stockholiana på köpet!,2
Bra och proffsig städfirma som var tillgängliga och tillmötesgående.,2
"gick därifrån och kände mig lurad. hade redan betalt behandlingen, fanns bara lediga tider på söndag och sedan fick jag betala extra för att det var söndag",0
"Tips! Läs på ""hallå konsuments"" hemsida om tillbakavisande av felaktiga fakturor. Bonprix verkar ha något sorts världsrekord i felaktig dubbelfakturering.",0
"Tomas är en människa med ett lugn som många saknar, vilket är sjukt positivt! Vi är jätte nöjda med vårat hus och vet vilken mäklare vi ska ta kontakt med hädanefter ifall det blir aktuellt. 10/10 getingar 👌🏼",2
"Fint. Synd att de höjt priserna och inte angett de på siten, utan det blev en överraskning vid betalning.",2
"Ett företag med otroligt hög personalomsättning om som inte kan leverera enligt överenskommelse. Allt ifrån tid, till städresultat är fallerande.",0
Bra info och hanterat. Lätt och värt,2
Lugn och trevlig miljö! Kompetent och proffsig personal.,2
Jättebra service. Estimerade priset håller utan överraskningar.,2
Tycker att en städare ska städa bättre än jag själv gör när jag betalar för det.,0
"Väldigt fin natur, okej bemötande från personalen. Tyvärr upplevde vi att varken mat eller spa-behandlingarna var prisvärda.",0
"Fönsterputs utvändigt. Helt ok med små missar ibland, men det händer alla.... Nöjd! Alltid bra bemötande!",2
"Mycket bra mat,trevlig personal.lite för bråttom att ta betalt!",2
"jag köpte en synundersökning och bågar, personalen var snälla och hjälpte en men det var ganska begränsat utbud av bågar",2
Sålt bostadsrätt. Mäklaren var alltid glad och trevlig och återkopplade bra. Dock nådde vi inte riktigt upp till vad lgh var värderad till.,2
Ingenting att anmärka på! Allt har flutit på som förväntat.,2
"Paulina var positiv, engagerad och kunnig och mycket bra i kommunikationen hela tiden. Utöver det var hon otroligt lyhörd för helheten i en fastighetsöverlåtelse. Gunnar",2
"I överlag en väldigt bra uppevelse, både mat och dryck var gott. Det enda dåliga var att vårt sällskap fick själva uppmärksamma personalen när vi ville beställa dryck och mat.",2
Trevligaste mäklaren jag mött och fått tips av andra om denna toppenkille,2
"Fantastiskt ställe! Trevlig, rar personal. Bra meny och riktigt god mat. Kan varmt rekommenderas.",2
"Bra service, problemet fixat. Men... oerhört dyrt. Bytte en packning i en kran, tog mindre än en timme. Tog betalt för två timmar och materiel som inte använts. Summa 2700 kr.",0
Mycket bra bemötande och snabb hantering! Kan varmt rekommendera er!,2
"Lite haltande. Hemfrid har svårt att hålla utlovad kvalitet. Devisen, lova aldrig mer än du kan hålla. Vi har dock fått svar och respons de gånger som vi klagar på utebliven leverans, kundnöjdhet etc.",0
Hjälpsam och mycket trevligt bemötande.,2
"Maries är bra på alla sätt, vi har städning varannan fredag. Skönt att komma hem till ett nystädat hem. De har bra kundsupport och städtjänsterna fungerar verkligen bra!",2
Larm och kameraövervakning Förutom att övervakningskamerornas huvudenhet är lite utdaterad så funkar det bra. ,2
Maten är på låg nivå. Tråkig meny. Trevlig betjäning men enbart på engelska. Nytorget 6 har sjunkit enormt i nivå sedan den öppnades. För halva priset hade jag varit nöjd.,0
Efter en vecka fick bilen åka in på ac-reperation. Har fortfarande efter ca en månad inte fått kopian på papprena..,0
Morgonrock registrerad på väg 23.12.19. Ej anlänt 30.12.19 Uselt! Birgit Svensson Åkervägen 29 1353 Tyresö,0
Snabbt och smidigt med allt från första kontakten!,2
Köpt en lägenhet. Blev väldigt bra bemötta av Mäklaren. Höll oss uppdaterade. Allt bara positivt.,2
"Läkaren var inte inläst, på vare sig provresultat eller journal vid återbesök.",0
"Snabb service, trevlig personal som bjöd på det extra fattades en skev gan fixade skulle byta sim-kort intelefonera han fixade köpte skal  han bytte o fixade",2
Hej VID FÖRSTA BESÖKET SOM TOG LÅNG TID BEROENDE PÅ ENDAST 1ST PERSONAL SOM FANNS I BUTIKEN NÄR DET VAR MÅNGA INNE KUNDE VARIT BÄTTRE MED FLER ANSTÄLDA PÅ PLATS ANNARS BRA INORMATION KRING SÄNGEN. NÄSTA GÅNG VID BOKNING AV SÄNGEN VAR DET VÄL OK,0
"Min upplevelse av Wallmans var tyvärr mindre bra. Vi har varit där förut och då var service, engemang  mm mycket bättre.",0
Fick varken orderbekräftelse eller kvitto. Heller inget svar från kundtjänsten när jag frågade efter det. Kepsen kom dock fram...,0
Maten var bra men väldigt liten portion. Inte prisvärt. Finns andra bättre ställen att gå till i närheten.,0
Utmärkt arbete! Arbetet utfördes i tid och det var lätt att komma i kontakt med Fläcke med snabba svar. Både tapetsering och fasadmålning utfördes. ,2
Usch vilket bemötande. För mycket tillkommande kostnader som känns dolda.,0
"Jättebra Gravid Pilates, hade gärna gått på fler träningskurser men blir lite dyrt inför föräldrarledigheten.",2
"Jättebra affär,bra bil och trevlig personal :)",2
"Har firma i Billdal anlitade dessa men  ångrar det, inget funkade.  Mycket dyrt och dåligt bemötande.",0
"Har köpt en sänggavel,fick ca 500kr rabatt. När det nu är dags arbetslag enl ök så har priset ändrats! Dåligt.",0
är en mycket engagerad och professionell mäklare som hanterade min lägenhetsförsäljning på bästa sätt.,2
Fyllningen är inte limmat på samma ställe utan den är för hög och därmed utsatt för högt tryck&slit vid mattuggning.,0
Mycket trevligt bemötande av säljaren. Köpte en begagnad Skoda Yeti - 13 Som är i riktigt bra skick.,2
Ingen aning om varför ni frågar detta. Har aldrig hört talas om Pielen Catering och event. Så de får betyget uselt för att de och ni slösar med min tid.,0
Jätte bra kurs! Bra balans mellan teori och grupparbete gjorde att det gick lättare att ta in. Kursledaren var väldigt erfaren och hade god förståelse för olika branscher och var lyhörd för deltagarnas behov.,2
"Jag tycker att servicen var jättebra, mkt trevlig servitör, men maten va typ 2 av 5.",0
Finns inte längre,0
Trevligt att ha med Helene att göra. Allt gick som smort. Nöjd med hennes arbete.,2
"Jag blev väldigt vänligt bemött, och fick snabb service. Och så vitt jag kan bedöma, ett bra jobb!",2
Jag hade önskat att ha en kontaktperson på Profilservice som tog helhetsansvar för min beställning efter jag berättat om mitt behov - vad det skulle användas till och deadline.,0
Jag har sålt flera bostadsrätter och anlitat Karin. Hon är helt enkelt bäst. Trevlig smart hjälpsam och är duktig på att sälja.,2
Forcerat intryck. Väljer en annan mäklare.,0
"Glada, trevliga och proffsiga är gänget på Beauty & Medical Team. Kan absolut rekommendera deras behandlingar.",2
Tätning av evakueringshuv Snabbt och bra,2
Service ventilation och köksfläkt. Bra bemötande och nödvändiga åtgärder.,2
De kunde inte utföra jobbet de lämnat pris på. Men de var trevliga.,0
Bra sakligt bemötande med ärlighet om priset. Bra service!,2
Väntar fortfarande på att reparera ac i husbil jag köpte där,0
"Trevlig och tillmötesgående, hade bra koll på allt jag hade funderingar kring. Uppfyllde alla de förväntningar jag tycker en mäklare ska uppfylla. Väldigt nöjd med andra ord.",2
Usel Kundservice och support efter betalning skett. Har alla leveranser/åtgärder åtgärdars som ingått i priset. Är kunden nöjd mm. Kommer aldrig rekommendera denna bilförsäljare.,0
"Snabb och smidig affär! Mikael är lagom i sin roll som mäklare, det inger förtroende.",2
"Bra och trevlig personal, lämna in bilen på service och det gick snabbt och enkelt, rekomenderar starkt",2
Jag var mycket nöjd med utbildningen!! Föreläsaren som jag tror hette Elis var super bra!! Jag lärde mig jätte mycket;-),2
"Bra bemötande och saklig information,  gjorde allt som efterfrågades plus lite till. Bra!",2
"Inspirerande goda rätter, stora portioner. Räkorna och laxen var mumsigt 😄",2
Det ända som jag tyckte var dåligt det var hjälpen med deklarationen. Annars är vi supernöjda.,2
"Rekommenderar gärna Hans Vogel som tandläkare, man får ett trevligt bemötande, och han gör ett mycket bra jobb. Dessutom lugn och informativ.",2
Allt var positivt ! Från beställning till fönsterputsen som vi är mycket nöjda med.,2
"kände att jag fick hjälp med ursprungsproblemet men alla komplikationer som uppstod under tiden blundade man för och rekommenderades att boka ny tid, trots att 20 min var kvar av behandlingen",0
KOPPARSTADEN Det mesta sköts dåligt... ,0
Man känner sig alltid välkommen och bra bemötande. Ibland kommer man in lite senare än utsatt tid(5min-8min).,2
Jag har köpt städning och fått bra och snabb respons när saker inte har fungerat som det ska. Även kommunikationen har blivit bättre. Dock är det en relativt dyr tjänst så har haft och har fortfarande höga förväntningar på tjänsten...,2
Underbar ansiktsbehandling! Louise är en väldigt varm och underbar person :) Rekommenderas starkt!!,2
Alldeles utmärkt städning och andra kringtjänster såsom strykning etc. Punktliga och noggranna. Kan absolut rekommendera Ania's städ till andra!,2
"Trevlig kille som kom och vispade runt med en borste på typ slipmaskinen i fläkten, tvättstugan, badrum. Tog ca 20 minuter priset 1.995 inkl. skattereduktion är saftigt för att ta bort damm. Trodde han skulle rengöra min fläkt och ev byta filter.",0
"Flytt från Göteborg till Stockholm. Riktigt bra service och stor flexibilitet vid bokning och bra, effektiv och trevlig personal vid själva flytten.",2
Trevligt bemötande. Snabb hjälp. Dock blev jag tvungen att reklamera jobbet. Det höll inte.,2
Jag köpte klassträjor för klassen. Tyckte det var smidigt. Blev väldigt bra bemött och fick hjälp med frågor jag hade. Toppen,2
varken bra eller dåligt hälsningar virvelvinsgatan 6,0
Snabb återkoppling i alla led. Bra redogörelse för alla delar i besiktningen.,2
"Jobbet man gjorde fungerade först bra, men när det sedan blev reklamation ville man inte vara lika smidig längre. Har sökt kontakt med företaget under flera veckor utan att lyckas. Jag skulle aldrig rekomendera någon att använda företaget.",0
Duktiga frisörer med bra service och vettiga priser! Synd att håret inte växer snabbare... ;)  /Kristian ,2
Stort tack till Stockholms bästa och trevligaste bilskola som visat mig att även gamla hundar kan lära sig att köra bil! Trygga lärare och ett varmt mottagande i receptionen - vad mer kan man önska sig?!,2
"Lagning av avgassystem, snabbt och smidigt fixat, och jag kunde köra hem utan oljud 😊",2
Blev hänvisad till en kiropraktor angående min fot. Mailade om tid och blev bemött bra! Hade inga förväntningar då detta är nytt för mig men min fot har blivit mycket bättre.,2
Han är väldigt duktig. Han försöker jätte mycket jag är glad,2
"Oerhört proffsig och trevlig. Yosef har varit exemplarisk och bemött oss på ett bra och trovärdigt sätt hela tiden. Snabb på att svara på frågor, engagerad, nyfiken och dedikerad sitt jobb!",2
"En vanlig dusch installation som blev en Nightmare. Dusch dörren bleve fel monterat, dörren stängs inte rakt, Installatörer borrade fel och fick 6 plattor skadade och nu vill dem bara fixa hålet med silikon. Verkligen oseriös helt otroligt.",0
BKB kittlade och målade om fönster. Vi är mycket nöjda och blev mycket väl bemötta. Vi kan verkligen rekommendera BKB Fönsterteknik.,2
Fick bra hjälp när jag hade problem med mina ögon och det var svårt att prova ut nya linser. Mycket välutbildade optiker som kunde pröva olika lösningar. Stort Tack!,2
Jag bytte skärmen på telefonen. Trevligt bemötande och det gick snabbt att byta. Toppen bra!,2
Sålde min bil via Autobarn. Seriöst och trevligt bemötande redan vid första kontakt. Känns tryggt då man blir upprättad under hela säljprocessen. Rekommenderas starkt!,2
"Bemötandet var mycket bra, säljaren var välkomnande och inte påträngande vi fick hjälp och rådgivning vid sängköpet leveranstiden var helt okej och kvaliteten på produkten uppfyllde förväntan vi var mycket nöjda.",2
Bra mottagande när jag gjorde bokningen. Gjorde en 2 års service på bilen. Upplever att jag har fått det jag bokade. Vänligt personligt bemötande när jag hämtade bilen.,2
Väldigt bra organiserat och genomfört. Mycket lärorikt för barmen på ett roligt sätt,2
Som köpare av lägenhet har jag känt förtroende för Åsa. Hon har uppträtt professionellt och haft en objektiv roll i processen. Kan varmt rekommendera Bostadsagenten och Åsa .,2
"Proffsiga,,smidiga,flexibla och prisvärda. Kommer rekomendera de vidare och anlita vid kommande flytt. 👍De är bäst!",2
Jag köpte en bränslepump med expressleverans men det tog 4 arbetsdagar innan den levererats och jag skickade ett mail och frågade om det verkligen hanterats som express den 25 Juli men inget svar på mailet än.,0
"Noggranna och mycket serviceinriktade, mycket ödmjuka och pålitliga! Jag kan start rekommendera bolaget. Birgitta Thörn//grundare av itrim",2
Lackering av biltak och motorhuv. Resultatet jättefint och över förväntan! Bemötandet kunde ej varit bättre!,0
Har just fått två krav från Kraft & Kultur på summa 55000 kr. Det ena kravet ver en betalningspåminnelse på 52230 kr. Någon faktura har jag inte fått.,0
Två av de fyra däck jag beställde försvann på något sätt. Det krävdes många kontakter och drygt två veckor innan man beslutade att ersätta dem med två nya.,0
Hade lite för bråttom och lämnade en hel del streck.,0
Jätte fin bil som förra gången och har alltid blivit väl bemött och jag är en ”gammal kund” bra priser på bilar trevliga prspnal som man får proffetionel hjälp alltid duktig mekaniker också en mycket bra upplevelse,2
Jag har två platser som Kundkraft sköter elleverantör åt mig på ett enkelt och föredömligt sätt. Även om andra ringer och erbjuder sin tjänst under bara ett år framåt så uppskattar jag Kundkrafts kontinuitet för billig el.,2
Hade gjort spraytan men blev orange. Plus att några ställen hade hon...jag vet inte vem inte sprayat. Men tack ändå för det här ni jobbar hårt som fan.,0
"Sist jag ville ha hjälp,men jag var nog osynlig,ingen brydde sej.dom såg mej de vet ja,så de fivk bli en annan verksta.",0
Återkopplade inte när jag bad om komplettering. Ärendet visade sig ha fallit mellan stolarna. Lyckligtvis kom dom ihåg att fakturera för en komplett städning.,0
Mycket gott bemötande när vi skulle teckna nya  avtal för fritidshus. Snabba svar och bra information om alternativ och villkor. Fortsätter gärna som kund hos Dalakraft och kan rekommendera dem till bekanta.,2
"AC service. Fick tid snabbt, väl utfört jobb o trevligt bemötande.",0
"Underbara Pinchos,den grill tallriken dom har är ett måste om man inte har testat den.Drinkarna är vidunderliga och atmosfären en kväll i juli, kan inte bli bättre...älskar Tranquilo",2
"Inget att rekomendera, de kaklade fel och fick lägga om golvet i vårat badrum. Det slutade med vattenskada i väggen och HELA badrummet fick byggas om! Hela processen tog 4 månader.... för kontakt Karro113@hotmail.com",0
"Lovar att lämna en offert, hör inte av sig, och när man frågar efter, så får man veta att dom inte har tid. Oseriöst!",0
Foliering som släppte 2gånger samt att dom hade skurit sönder lacken på min bil  med kniv. Så dom fick läckra om mina trösklar på min helt nya bil.,0
"Bra, snabba och smidiga och levererar",2
Ej fått produkten än Ingen återföring  av synpunkt,0
"SBO däck har gjort ett kanonjobb på mina två däckbyten. Sammy är väldigt tillmötesgående, och fixar även andra mindre fel på bilen (ingenting är omöjligt) Jag kan verkligen rekommendera Sammy      Jan R ",2
Bemötande och service toppen! Prisförslag för arbetet direkt vid bokningen. Arbetet utfört utan förseningar. Kan enbart rekommendera denna verkstad,2
Helt ok städat men fakturan var 900:- högre efter rot än överenskommet när den kom. Fick en ny efter påpekande utan kommentar. Dessutom hade man slitit av kabeln till tvättmaskin när man dragit ut den. Sånt som händer men man kan tycka att de kunde säga till.,0
"Extremt missnöjd. Hon lovade grejer hon inte kunde hålla och gick bakom ryggen på mig, allt för att bara avsluta affären och få sin del av kakan! Sämsta upplevelsen jag någonsin haft med en mäklare!",0
Bra och personlig service. Kunnig och trevlig personal. Skulle inte kunna vara mer nöjd.,2
Hon som städade var mycket bra nogran och duktig jag var  mycket nöjd,2
"Jag har köpt dammsugarpåsar och tycker att de är jättebra. Påsarna  kom bara efter 2 dagar, bra service",2
"Köpt ny bil. Bra mottagande, tydlig offert, leverans enligt avtal.",2
"Flyttbolaget, hjälpte mig med flytt. Och dem bemötte mig med jätte bra. Den bästa Flyttbolaget någonsin!!! ",2
Tappade en massa pengar på att verkstaden sa att bilen behövde ny motor när det var en enkel sak att åtgärda som en duktig mekaniker gjorde på en timme.,0
Inte särskilt service minded Fick själv ringa och påminna liksom ringa och dubbelkolla hyrbil som jag fick vänta på för de inte hade koll,0
Trevligt och proffsigt bemötande! Tydligt vad som skulle göras och pris på det. Snabbt avklarat. Jag är jättenöjd!!,2
Hej Jag är mycket nöjd med den hjälp vi fick av FlyttGiganten i samband med vår flytt för några veckor sedan. ,2
"Har varit hos Alexandra på olika behandlingar, alltid lika nöjd när jag går därifrån. Inte bara med resultatet, även er trevliga personal som får kunden att känna sig bekväm. Kommer fortsätta gå till Unni mood!",2
Jag tycker att Blå expressen gjorde ett kanonbra jobb och de högsta betyg.,2
"Fick kontakt med Marcus genom reco.se. Fick hjälp med att få byggt ett tak med tillhörande staket till källartrappen. Bra kommunikation. Snabbt, smidigt och gott utfört arbete. Precis vad jag önskade. Rekommenderas varmt",2
USELT. Anser mig lurad. 21.000:- för att flytta elcentralen 30 cm.,0
Mycket trevligt bemötande och utförd tapetsering noggrann och professionell.,2
Jag har sålt en lägenhet. Väl bemött med snabb och smidig affär! Bra engagemang från mäklaren. Rekommenderar Fastighetsbyrån för en seriös och engagerad affär.,2
Arbetet utfördes till största belåtenhet med stor proffsighet. Jag upplevde otydlighet vid betalningen då det gick till annan adress än vid beställningen.,2
Väl utfört arbete. Pålitlig och trevlig. Löste mitt problem som tre takläggare tittat på innan och inte hade rätt lösning. Bravo,2
Sålde 2 bilar snabbt och enkelt. Trevligt bemötande. Victoria ,2
"Vi har fått hjälp med packning, flyttning, uppackning samt städning av den gamla bostaden. FlyttGiganten utförde det som avtalades och därutöver. Mycket trevliga, ansvarsfulla och proffsiga tjejer och killar som hjälpte oss i tre dagar!",2
"VARNING!!! LÄMNA ALDRIG BILEN DÄR!! Otrevliga/respektlösa, lurar folk och följer inte deras villkor!!",0
"Smidig och proffsig flytt- och städhjälp! Bara bra, kan rekommenderas. Prisvärt!",2
"Christina hjälpte mig att sälja min lägenhet. Hon har varit otroligt hjälpsam, kunnig och har varit ett stort stöd då jag tidigare inte sålt en bostad. Hon har varit engagerad och väldigt trevlig!",2
Dåligt bemötande och alldeles för dyrt. Köp bågarna här och ta dom någon annanstans för slipning. Då slipper ni bekymmer med personalen och det överdrivna priset.,0
Väldigt mycket PÅ. Gav inget seriöst intryck. Det enda som var intressant var att få en påskrift på kortast möjliga tid. Inget om att skapa en nöjd kund,0
Jag blev sämre av den behandling jag fick här. Borde uppsökt en sjukgymnast istället.,0
Alltid kul när boxen kommer. Intressant och spännande innehåll som uppskattas av hela familjen. Bra service när något har strulat. Kan verkligen rekommendera denna box,2
Trevligt bemötande och proffsigt utfört. Fick hjälp med gräsklippning och det blev verkligen bra.,2
"Sökte hjälp efter en olycka, blev inbokad med naprapat inom ett par dagar. Fick jättebra hjälp, behandling och övningar som har hjälp mig att återhämta mig väldigt snabbt. Väldigt proffessionellt bemötande har jag fått, alla mina förväntningar har blivit uppfyllda.",2
"Sämsta bemötandet, gjorde inte klart vad de lovade, gjorde hål i väggarna och var dessutom dryga och otrevliga. Kan inte rekommendera dem.",0
Jag köpte en säng. Jag fick fint bemöyande och företaget levde upp till min förväntan. En bra kundupplevelse.,2
Helt fantastiskt! Mycket noggrann och professionellt utförd behandling med mycket bra resultat. Cecilia är supertrevlig och har mitt fulla förtroende! Rekommenderas starkt!,2
Jag brukar köpa Stockholmslådan och det är alltid lika roligt att packa upp,2
"Enkelt, skönt. Fönsterna blir bara putsade inanna jag hinner tänka på att de är skitiga",2
Nya led extraljus som doldes/integrerades snyggt i grillen... kanon nöjd!,2
1. Storstädning + Fönsterputsning 2. Förträffligt 3. Hade förväntningar men inte så bra som det blev när allt var klart. 4. Enormt bra av personalen och arbetsledaren,2
"De kursledarna vi hade på vår utbildningsvecka bidrog till att helhetsupplevelsen blev negativ tyvärr. Jag var inte ensam om bedömningen att vi möttes av kursledare som uppvisade brist på respekt och som aktivt valde att vara raljanta, korrigerande (trots inledningsanförande om att våga vara modiga).",0
Helt enkelt exemplariskt. Ska man köpa eller sälja sin lägenhet ska man absolut göra det med hjälp av Emil.,2
"Från början var jag lite skeptisk efter som jag alltid städat själv. Men nu tycker jag att Hemfrid är helt fantastiskt, den städerska vi har är rar och mycket noggrann. Om något blir fel ringer man bara Hemfrid så löser dom det. Alltid lika vänliga och tillmötesgående.",2
Jag bokade lunch för 7 personer. Fick snabbt en bekräftelse. Bra service vid lunchen och god mat. Sammanfattningsvis en positiv upplevelse.,2
Bra bemötande och uppriktig vilket jag anser är en dygd. Även hjälpsam med frågor och funderingar. Kommer rekommendera vänner... om bilen håller.,2
Rekommenderar inte...............................................................................,0
"Som man vill att det skall vara: löste problemet och lite till, trevliga, svarar på mail och telefon.",2
Fick snabb och proffsig hjälp både vid bokning och vid själva flyttdatumet! Mycket trevligt bemötande och kunnig proffsig personal! Stort tack för erat varma bemötande!,2
"Har använt en del mäklare genom åren och Andreas är den bästa! Lyhörd, hungrig och går den där extra milen. Dessutom rolig och enkel att ha och göra med.",2
Rekommenderar Inreno företag. Jag tackar för ett utomordentligt jobb av de tre killarna som kom och städade min lägenhet. Alla jag pratar med får veta hur nöjd jag är. Vänliga hälsningar Marie ,2
"Fina bilar till rätt priser. Bra inbytes pris. Avslappnad försäljare, inte för på. Bara positivt.",2
Väldigt snabb leverans.Och lätt att hitta vad jag skulle ha.,2
"mycket nöjd med mäklaren,  höll mig informerad om allt som hände under hela processen med min försäljning av mitt föräldrarhem. Nöjd med allt. Tack Pelle!!",2
"Inte nöjd någonstans dessvärre, information som inte delgavs som verkligen var av betydande art och rent krasst en avgörande faktor för just vårt köp, vilket hade blivit ett icke-köp om vi hade fått den informationen. Så under all kritik tyvärr.",0
Vår(stor)städning och fönsterputs i vår stora lgh som skiner i kapp med solen numer! Snabbt (ca 4 timmar) och professionellt. Vi vill gärna fortsätta med fredagsstädning varannan vecka!,2
"Tomten som ska säljas, är fortsatt inte såld. Detta gör att en sammanfattande bedömning är svårt. Dock tycker jag fram till  nu att kontakten inte har varit kontinuerlig.",0
Botox. Ytterst professionellt bemötande,2
Trevligt bemötande och bilen är i trygga händer.,2
"Riktigt riktigt usel service, när man blir ifrågasatt så skyller man (som tjänsteman) på andra inom bolaget. Undvik detta ställe.",0
Jag beställde en propeller på nätet. Snabb leverans o bra med faktura genom klarna utan avgift.,2
Dåligt bemötande och slapp inställning och uppföljning. Ointresserad.,0
Lätt att få hjälp av kunnig och trevlig personal o snabb service.,2
2 olika kjolar med innerbyxa och ett par shorts. Mycket bra tyckte jag det var och snygga. Snabb leverans.,2
Tack för suverän hjälp med försäljning av vår bostad! Allt gick så smidigt till! Professionell och tillmötesgående från första stund. =),2
Sådär. Massage fungerar bättre för min rygg och jag får mer för pengarna där.,0
"Fantastisk miljö,supergod mat. En trevlig upplevelse",2
Jag tyckte att flyttkillarna var snabba och effektiva och priset för hela flytten var jag mycket nöjd med. Carita,0
Hon kunde fånga det jag själv fastande för då vi köpte bostaden och lyfta fram det vid försäljningen. Hon såg möjligheterna .,2
Bra servicesv färdig i tid och jag är nöjd med hur arbetet e utfört. Hälsningar Anders.,2
"Rivning av tak, eternit och plåt. Trevligt bemötande, professionellt skött, trevlig personal. De motsvarade våra förväntningar och levererade i tid. Överlag mkt bra skött arbete!",2
"Trevlig tjej, trots att jag var sen. Första gången med spraytan för mig, helt okej.",2
Jag hade påsar under ögonen som var väldigt störande. Jag kan inte med ord beskriva hur nöjd jag är. Över all förväntan. Rikard,2
Jag upplever att jag blir bra bemött och är nöjd som kund hos er på Tandea.,2
