Stockholiana på köpet!,2
Ta bort en prick i pannan. Trevligt bemötande och snabb behandling. Är inte nöjd med resultatet. Pricken är fortfarande kvar. Möjligen något blekare färg. Jag kommer att kontakta Citylaser för reklamation.,0
Marie Louise tog hand om försäljningen av vår bostadsrätt på ett mycket professionellt sätt. Hon var väldigt engagerad och lyhörd och höll oss hela tiden uppdaterade. Allt kändes mycket tryggt och bra och hela affären gick väldigt snabbt och smidigt.,2
"Peter sålde vår villa i Häljeröd. Han är kunnig, pålitlig, effektiv och riktigt trevlig! Bra kommunikation och snabb återkoppling genom hela processen. En grym mäklare som jag rekommenderar alla dar i veckan!",2
"Trevlig bemötande, flexibilitet och god tillgänglighet. Kan verkligen rekommendera Fastighetsbyrå Mora och mäklare som arbetar där.",2
jag gjorde en service på bilen samt byte till vinterdäck väldigt bra motagen snabb service,2
"Försäljaren oseriös, ta inte larm från Garda Alarm, nu kommer fakturorna på 933 kronor istället för 345 kronor på Sector . Vi är helt grundlurade. Försäljaren sa att larmet skulle bli billigare än Sector alarm.",0
"Jag köpte en säng, som levererades samma dag som det var bestämt. Inga konstigheter eller problem.",2
Bra. Tyckte att det är lite lurigt att sälja madrasskydd dyrt som villkor för att få bytesrätt. Dessutom är priserna på bäddmadrasser oskäligt höga.,2
Jättelurig verkstad. Försökte blåsa oss på flera tusen.,0
Xxxxxxxxxxxxxxxxxccxxxcxxcc,0
Reparation av bil. Dåligt utfört jobb och dåligt bemötande,0
"I flera år var jag medlem i Kundkraft, men det var först efter det jag kunde spara pengar genom att förhandla själv och då sparade jag rejält med pengar. Jag blir bara så förbannad när jag ser deras reklam över deras värdelösa skit.",0
Beställde service och fick ett bra bemötande på telefon. Servicen gick fortare än planerat och dessutom billigare än det serviceställe jag normalt anlitar.,2
"Snabbt, enkelt med ett mycket trevligt bemötande, rekommenderar starkt.",2
Ni kan börja med att använda rätt förnamn eftersom jag vill inte vara i nåt dataregister pga detta kommer jag att undvika all kontakt med mekonomen,0
"Jag var missnöjd över mycket. Telefonupplysningar, servicen samt fakturan. Det är tveksamt om jag anlitar dem fler gånger.",0
Mysig restaurang. Inte så trevlig personal och maten va god men inte mer än så,0
Sämsta jag varit med om. Extremt fula fransar som hon dessutom inte satte längst in utan typ 2cm så msn såg mina blonda fransar. Så skulle jag få pengarna tillbaka som hon lovade men nu blockade hon mig överallt och har inte fått några pengar,0
Jag klippte och färgade håret hos Natalie. Det blev precis som jag ville! många tunna slingor och perfekt balans mellan mörkt och ljust. Tusen tack!,2
Ohygienisk personal.,0
Trevligt bemötande. Vi använder dom för städning som är mycket noggrant .,2
Storstädning och fönsterputs. Mycket trevligt bemötande och snabbt svar. Levde upp till förväntningarna.,2
"Vi köpte de dyra biljetter och skulle sitta bra, men såg mest rygg av alla uppträdanden.  Sedan så var det ett plastregn som nästan bara kom över vårt bord, förstörde våra drinkar och efterrättsvinet som kom efter efterrätten. Dåligt!",0
Jag kan inte säga någonting positiv jag har inte fått det ja beställde och kommer inte att beställa någon mer från dem,0
Otrevligt och jag fick mer problem av att gå dit. Kan inte rekommendera stället.,0
De gav mig en bra och snabb service när jag hade problem med min bil. Dels per telefon och dels på verkstaden.,2
"Jag är så nöjd verkligen med allt!!!!! Har fått jätte bra coachning i mitt körande under hela den här perioden,hade aldrig klarat att ta körkort utan kullens!!",2
Inget bra första besök ! Troligen inte igen ! Felet åtgärdades inte ! Dom kollade aldrig att felet var avhjälpt !😞,0
Proffsigt och bra intryck. Vi fick bra råd och tips rekommenderar starkt,2
Nonchalant. Var bara en i mängden. Hade inte ens tvättat bilen fast dom visste flera dagar innan att jag skulle komma.,0
"Vi är väldigt nöjda med de tjänster vi köpte genom städjätten, både flytt- och städhjälp. All personal som vi haft kontakt med var proffsiga, lyhörda och alla hade ett gott bemötande.",2
Vi upplevde inte denna mäklare som hjälpsam och informerade!  Det höll på att bli ett kontraktsbrott från vår sida pga av att mäklaren ej informerat oss om situationen! Ingen mäklare jag skulle rekommendera till vänner.....,0
Min röstning talar för sig själv - uselt företag med uselt bemötande!,0
Bambukuddar 2 st. Absolut det bästa jag någonsin köpt! Otroligt snabb leverans.,2
"Denna person vill jag direkt varna för, är oklar med saker och ting. Tar dessutom arvode som inte är uppgjort från början och då helt orimligt!",0
Köpte flyttstäd. Otydligt med tider och svarade inte tydligt på förfrågan. Smutsiga golv efter städ. Rengjorde ej väggar. ,0
"Trevlig tjej som jag tror gjorde det hon skulle med köksfläkten, men 1280 kronor för tio minuters arbete är naturligtvis för mycket!!!",0
Professionellt bemötande. Bra uppföljning. Hjälpte med mitt ryggskott.,2
"Karaj Bygg kan lita på ,allt vi kom överens blev gjort i tid. väldigt bra att få hjölp med allt. tack för en utmärkt bra gjort jobb. Jag varmt rekomenderar Karaj Bygg.",2
"Perfekt service, kan varmt rekommendera alla att köpa bil här! Hjälper till med allt!",2
Kontakta restaurangerna direkt. Onlinepizza skickar faktura även då maten inte levererats och svarar sedan inte på mail. Rekommenderar inte!,0
Tyvärr va jag inte nöjd med min fransförlängning som jag gjorde!,0
Kändes faktiskt inte som en visningsstädning. En hel del grejer kvar på golven. Toastolen inte helt ren mm.,0
Bra bemötande från början till slut. Vi renoverade ett badrum och lade in nya golv i huset. Vi blev nöjda med resultatet.,2
Har nu för tredje gången (av tio beställningar totalt) fått fel vara levererad. Nelly verkar ju ha allvarliga problem med logistiken. Orkar inte mer strul med att skicka tillbaka och vänta på återbetalning så detta var sista gången jag någonsin beställer därifrån!,0
"Dålig och slarvig service, blev extremt fel och jag som kund fick betala för felet.",0
"Underbar miljö som ger en ""NY-känsla"". Matupplevelse där man själv får vara delaktig och välja ut sina egna råvaror (kött/fisk). Goda drinkar och bra service. Högljutt men ack så härligt!",2
"Månadspriset för januari var 92,81 öre + en månadsavgift på 49 kr. Dessutom fick jag betala 4 öre för 100% solkraft, som jag inte beställt. Kan inte ha ett bolag med så höga påslag. Mvh Eva Aleson",0
Mycket nöjda med vår flyttstäd. Rekommenderar dem gärna!,2
Bostadsflytt. Utmärkt genomfört och trevligt bemötande på alla sätt från första kontakt på mail till avslutad flytt. Jag rekommenderar absolut A-J express service,2
Vi fick ANK hem till oss genom Bauhaus Montageservice och vi var helt förfärade över resultatet. Felinkopplad diskho ledde till fuktskada i hela köket vilket gjorde att vi fick riva upp golvet de lagt och torka i VECKOR. Rekommenderas INTE! ,0
Förväntningarna var höga men de höll inte. Osäker men trevlig personal. Miss i beställningen. En huvudrätt istället för två. Ingen antydan till kompensation. Hutlöst dyrt för tre tunna skivor anka! Mkt bra smakkombinationer. Dessert och kaffe hemma.,0
Installatören trevlig men jobbet slutförde inte trots påpekanden till Ekerö Kök.,0
Väl fungerande elleverantör - har alltid fungerat för oss. Har inge funderingar på att byta leverantör för närvarande.,2
FICK en felaktig vara som direkt gick sönder. Går ej att ringa företaget,0
Ständigt blivit besviken på bolaget. Alltid ifrån kvalitén på städningen till kundkontakten. Ingen vidare ansvarstagande ifrån någon.,0
Hej! Upplevelse av för lite utforskande av min skada. För stor vikt av att för snabbt anamma en idé. Följa en manual med kryssfrågor och fotografering. Blev tyvärr bara sämre och ägnar mig nu åt en långsammare och djupare sjukgymnastik som gynnar min skad mycket bättre.,0
"Besviken. Nonchalant bemötande, medioker mat och det luktade sopor där vi satt.",0
"Hon stressade upp budgivningarna, vägrade återbesök i lägenheten. Hon gav inte ett seriöst intryck o företrädde endast säljaren. Hon kunde inte svara på frågor om elledningarna var utbytta mm. Skulle aldrig använda el rekommendera henne eller Erik Olsson.",0
"Hej, har svarat tidigare att jag är nöjd med rep- arationen, eftersom jag inte kan se den. Mvh Magnus",2
Mycket bra bemötande av de två personer jag har träffat. Jag har fått RN behandlingsplan som känns bra. Trevliga lokaler.,2
"Alltid välkommen, positivt bemött och omhändertagen!",2
"Bra bemötande och seriös behandling.  Påläst och kunnig, kan rekommendera.",2
"Snabb & proffsig service! Jag har alltid varit nöjd,- så kan bara rekommdera!",2
Jag hade förväntat mig återkoppling av mekaniker under pågående undersökning. Nu fick jag ingen information om undersökningen (som inte kom fram till något och problemet kvarstår) och den kostade flera tusen. Känns tråkigt.,0
Tillmötesgående. tillgänglig trevlig kunnig jättebra!,2
"Både sålt och köpt hus av Lucas. Väldigt bra bemötande, påläst och kunnig. Viktigt att känna sig trygg i en fastighetsaffär.",2
Allt jag kan säga är att det hat fungerat jätte bra samarbetet med fastighetsbyrån i Lund. Ett stort TACK till Johan Lundahl ! - som har hanterat försäljningsprocessen av vårt hus med en hög professionell kompetens.,2
Bra naprapat  med vettiga åsikter väldigt kunnig,2
"Är hittills mycket nöjd, får alltid snabba mailsvar. Flytten gick mycket bra, trevliga killar och duktiga. Har ännu inte fått städning, blir den 14 febr, hoppas den blir lika bra! ",2
"Bara positivt och säga om detta företag, rekommenderas varmt !",2
"Alltid lyhörda, tydliga, snabba och med suveränt resultat",2
Missade min däckskiftesbokning samt ringde och avbokade min andra tid.,0
"Däck ej balanserade korrekt, fortf vibrationer. Fick balansera om dom på annan plats = löst. Hade utbyte av en fälg och sa att jag ville behålla min gamla fälg men dom försökte behålla den ändå. Fick gå in i verkstaden och hämta den. Dålig kommunikation.",0
"Siyar är väldigt professional och snäll,man kan lita på honom utan stress.",2
"Sotning av ventilation, köksfläkt. Trevlig och kunnig kille som utförde jobbet.",2
Hej. Anja städade hos mej i Augusti 2013. Hon var trevlig och städade bra. Jag blev nöjd och har rekommenderat henne till mina vänner. Med vänlig hälsning Marie,2
Bilen har sedan köpet visat Motorlampa då och då. Det visar sig att felet beror på tändspolarna. Detta omfattas inte av garantin jag blev rekommenderad. Och säljaren har varit ovillig att hjälpa mig att åtgärda felet. Jag är milt sagt missnöjd.,0
Bra service och mycket trevlig personal. Noga och bra städat samt kundservicen är mycket bra! +++++,2
"Köpte T-fästen för takbox, snabb leverans och de fungerade som jag tänkt mig",2
Naprapati och även ett tillfälle för kiropraktik för höftproblem och ländryggsmärta till följd av ensidig hälseneruptur,2
Snabbt arbete. De olika hantverkarna kom när de skulle vilket gjorde att arbete flöt på. Badrummet blev fantastiskt.,2
Köpte service och reparation av bilen. Bilen skulle bli klar samma dag. Lämnade in bilen och den blev klar först nästa dag. Detta gjorde att det blev väldigt besvärligt att hämta bilen.,0
Trevligt bemötande och en seriös hantering av en lite speciell bostad.,2
"Omhändertagande och lugn personal, tid för avkoppling. Rekommenderar dem varmt",2
6 st Mäss tält med viss extra utrustning Utmärkt bemötande  Absolut  Mycket bra upplevelse ,2
"Åt skaldjur som inte var toppen. Utöver det trist service, tyvärr",0
Vi köpte en villa i Limhamn via Michaela. Hon var väldigt snabb och noggrann med att ta fram all information vi önskade kring området etc. mkt nöjda och skulle själva gärna anlita Michaela.,2
Enormt bra mat och service för det rimligaste priset i stan.,2
Supertrevlig personal och bra mat. Traditonella rätter med lite edge i. Gillar lokalen. Särskilt det avskilda rummet på övervåningen. ,2
Trevlig butik med kunnig personal som gav bra service.,2
"Överlag väldigt nöjd, men kommunikationen från områdeskontoret kunde vara bättre.",2
Väldigt dåligt utförd rekond. Trots val av deras bästa rekond var bilen knappt städad invändigt. Skulle starkt avråda från att använda denna firma för att rekonda er bil!,0
Målning av takpannor. Bra bemötande och ett bra jobb på taket. Att man sprutar ner gräsmatta och plantering med medlet som användes på taket var inte ok. Härav kom mina förväntningar på vad ni skulle göra på skam,0
Fick bekräftelse på min order men en vecka efter har jag fortfarande inte hört eller sett något om den blivit skickad från Sveabad. Kontaktade deras kundtjänst men har fortfarande inte fått något svar om vad som hänt med min order.,0
Framfusig går på som en galning. Glömmer saker bedrövlig .Kommer inte att anlita er igen hade 3 lgh att sälja till men valde att byta mäklare.,0
Jag köpte kryddor och lite grilltillbehör till sonen en perfekt present för en grilltokig kille. Bra snabb leverans vilket är kanonbra!  Tycker konceptet är roligt och annorlunda. ,2
Tjänster jag valt har fungerat perfekt. All kommunikation med företaget har varit utmärkt,2
"Service. Blev meddelad felen och vad det skulle kosta att åtgärda. Bra, rak kommunikation.",2
Mitsubishi ecodan 112 Leverans och faktura kom fort. Men något intresse att sköta sina garantiantaganden fanns inte. ,0
"det är lätt att finna vilka varor man skall ha,och det är rena varor",2
Lackförsegling. Har gjort detta under 10 år på min tidigare bil. Nu när jag bytte bil var det ett självklart val.,2
Vi satt oppe i 2. etasje. Vi så ingenting av det som skjedde på scenen. Dette er vi veldig skuffet over. Alt for dårlig bordplassering. Maten var dog god. ,0
Rehab efter skada. Mycket bra bemötande Hade höga förväntningar som än så länge blivit bemötta,2
Tackar ödmjukast för all hjälp med mitt körkort. Sen vill jag säga ett stort tack till Annika för att du trodde på mig hela vägen!! Ni är bäst!,2
Jag köpte däck och var i chockаt  ner kom att hämta dem i utlämnings ställe på bilverkstad. Ägare av verkstaden var otroligt osnäll,0
Bader Bygg gjorde ett utomordentligt bra jobb med att byta ut en fasad samt balkongsidor på vårt radhus. Allting gjordes snabbt och bra under tiden som beräknades från början. Vill verkligen rekommendera Bader Bygg.,2
"Jag kan varmt rekommendera STB-gruppen. Mer än väl utfört arbete, jag är verkligen nöjd. Bilen är som ny. Dessutom ett mycket trevligt bemötande och hög servicenivå.",2
"Servicenivå något låg, vi upplevde miljön som stressig. Maten var ok, men för små portioner (bouillabaisse).",0
Sällan någon är vi telefonen Vi fick vänta 2 veckor på en enkel åtgärd,0
Vi är mycket nöjda med de arbeten ADK har gjort i vårt hus,2
"Vi åkte på en tur med ribb båtarna 2 st ,ut till Svartsö och fikade . Väldigt trevligt bemötande och trevlig ,säker åktur. :-)",2
Köpt en villa via svensk fastighetsförmedling & Daniel Ceylan. Bara positiva erfarenheter rakt igenom! Mycket trevlig och professionell mäklare!,2
Felsökning. Ärligt snabbt svar och bra bemötande. Mer engagemang än förväntat! Mekanikern informerade om att det var en reklamationsskada. Kändes professionellt!,2
"Trevlig bemötande hela vägen! Jag klippte mig av en trevlig och duktig elev, och fick rikligt med provprodukter.",2
Coolt och trendigt ställe med god och bra mat! Rekommenderas!,2
Provade oxfilé spettför några månader sen beställde köttet medium fick svart/bränt oätbart påpekade det direkt för personalen som ryckte på axlarna. Skitmat som lagas utan stolthet.,0
Uppdrag att bygga hiss och nytt entréparti till ny kund. Det har utförts med kvalitet för mig som beställare och för kunden,2
SPA-massage Fick komma in en kvart försent vilket gjorde att massagen bara kändes stressande och det blev en kvart mindre med massage! Uselt!,0
Trevligt kundbemötande och bra service! Helt enkelt stress fritt och enkelt.,2
"Ett jättebra bemötande av Nina, hon höll oss uppdaterade hela tiden",2
Mycket duktiga trevliga och rena! De har fixativen fantastisk tak . Jag rekommenderar de stark!,2
"Överlag bra vällagad mat. Tyvärr virrig service med konstiga prioriteringar av personalen. Diskbackar stod bakom min rygg under hela måltiden. Jag vill sitta i restaurangen inte i ""disken"" i fortsättningen.",0
Blev inte särskilt vänligt bemött av hovmästaren.,0
"Jag köpte ett brandlarm av dem, fick lämna tillbaka det dagen efter, eftersom larmet gick hela tiden.. Så nu väntar jag på att få tillbaka det igen",0
Otroligt god och fräsch mat! Jättemysig miljö och serviceminded personal! Hit kommer vi igen.,2
"Sålt på förhandsvisning, en mycket smidig och snabb affär. Sara är driven, personlig och professionell. Mycket nöjd!",2
Ett bra och proffsigt bemötande från första början.,2
De har inte förändrat sitt beteende sedan Susannas recension 2009.,0
Bästa tänkbara bemötande. Allt till belåtenhet,2
Vi var mkt missnöjda och har givit Caroline personlig feedback,0
"Väldigt nöjd med hjälpen jag fick av Alvis. Snabb service, kunnig och trevlig personal!",2
plåtning balkong. bra bemötande lite lång väntetid  lite lång väntetid bra utfört jobb,2
Struligt med stort S! Glada med okunniga!,0
Ringde ej och sa vad det skulle kosta när jag bad om det. Fick dyrare fakturan än vad som var förväntat. Personen blev otrevlig och var tvungen att åka iväg när vi diskuterade. Tar ej kort.,0
"Kraftig varning,otroligt oseriöst.Se till att få papper på allt! Har blivit kraftigt lurad,anmäld till Arn ",0
Marred AB sköter min bokföring och redovisning. Från första kontakt har jag blivit väl bemött på ett professionellt sätt. Dom är alltid snabba med att svara på mail.,2
"Stort, fräscht , bra utbud av skivstänger och vikter! Bra utbud av klasser. Lättillgängligt!",2
Känns inte som att de har tid för sina kunder! De är billiga och det känns som att man får vad man betalar för = slarviga.,0
Bra bemötande under hela köpprocessen av bilen och eftersom jag inte hade några förväntningar så har de uppnått dem med råge. Till dags dato har det skött mitt köp bra!,2
I samband med min flytt fick jag bra hjälp av Landala städservice trots att jag själv inte kunde vara på plats!,2
👎👎👎👎👎👎👎👎👎👎👎👎👎👎👎👎👎👎👎👎 DÅLIGT,0
"Proffsig och med stenkoll på bostadsmarknaden. Anlitade Jonas, då jag hade följt hans försäljningar i Tuve och konstaterat att han gång på gång slår alla rekord i min förening. Blev inte besviken - Jonas levererade med råge! ",2
Tusen tack för all hjälp! Vi kommer garanterat att höra av oss till er igen vid nästa flytt :-),2
Inte nöjd med resultat trots korrigeringar. Inget speciellt engagerat och förstående bemötande av dr. Hober. Uppvaket var rent ut sagt hemskt. Trots få rum och många i personalen så kändes man bortglömd och ensam. Upplevde detta flera gånger. Kan tyvärr inte rekommendera.,0
Jag heter inte Bo! Men det spelar uppenbarligen ingen roll!,0
Trevligt bemötande Massage hos Gabriella Jag mår bättre efteråt. Skulle rekommendera Joylife.,2
"Dåligt bemötande, otrevligt. Lite information. Tydligt att han själv ville lägga ner minimalt med tid. Icke-flexibel.",0
Besöket OK  men offererat pris blev 9000 istället för 5400 som offererats utan att jag fick någon information inte alls Ok det är andra gången jag råkar ut för detta,0
Jag tyckte att mäklaren var ganska oengagerad och jag fick själv ringa honom för att få information. Ingen mäklare jag skulle anlita igen.,0
En fantastisk box med som ger mycket inspiration. Man får prova saker man aldrig köpt annars. Man får mycket för pengarna! Superkul!,2
Allt är bäst! Prova en sparkling afternoon tea med någon nära och kär!,2
"Sämsta flyttfirman någonsin. Överenskomna tider hölls ej, priset blev det dubbla mot offerten, massor med trasigt porslin. Inget vidare helt enkelt.",0
"Ordered an item and got an email saying it was out of stock and that the order was cancelled. From a customer service standpoint it would have been better to offer an alternative item, or ask if I wanted to keep the order open while they restocked.",0
"Han ""missade"" att upplysa mig (köparen) om att det är en stor spricka i duschen. Det säger väl rätt mycket?!",0
"Åt middag flera personer och blev bemött på ett utmärkt sätt! Vi hade bokat bord ute men pga ösregn så kunde vi inte sitta där, så personalen löste snabbt ett bord inomhus.",2
"""Sturefors stolthet"" är ett av många smeknamn som denna gedigna lilla restaurang blivit kallad. Här får du grekisk mat, typ tatsiki och sådant! Priserna är satta helt i correspondence med vad som erbjuds!",0
"Stefan genomförde försäljningen av vårt hus på ett väldigt proffsigt, tryggt och informativt sätt. Tack Stefan, du är grym!!!! ",2
En lärorik utbildning med kunniga och engagerade handledare.,2
"Bilservice och mindre reparation.  Allt var smidigt! Bra pris, snabb service, trevligt bemötande.",2
"Katastrof, han ljög!! Han uttalade sig om saker han inte visste.",0
Arbetskläder- uniform för lagning och ändring. Blev väl omhändertagen även om viss personal inte talar svenska och fick kalla in andra för hjälp. Resultatet blev iallafall bra.,2
Köpte glas till egna bågar. Blir alltid bemött på bästa sättet,2
"Veldig fornøyd med vår opplevelse på Wallmans salonger i Stockholm forrige helg! Fantastisk show, fine sangstemmer, humor, bra musikkvalg og veldig god mat. Topp score fra oss! :)",2
"ähhh, ärligt talat, detta funkar väl inte längre. funkade inte för min del.",0
"Herrklippning Frisören förkortade håret - ja. Men ingen kreativitet alls. En osäker och nervös känsla från denna frisör. Bemötandet var välvilligt, absolut. Men helt utan självförtroende.  En dålig dag kanske...  / ",0
Ett juste elföretag som inte stoppar överskottet i egen ficka,2
Acn var trasig. Bromsarna behövdes byta ut. Radion var trasig. Om ni verkligen kör de här kontroll som ni säga att ni gör så är eran mekaniker uselt.,0
Mycket bra och snabbt service. Snabba och hjälpsamma svar på alla frågor. Fantastisk! Rekommenderas varmt!,2
Trevligt och professionellt bemötande och tillgängliga för eventuella frågor!,2
Trevligt bemötande och varit nöjd med det utförda arbetet.,2
"Professionellt, estetiskt och i en lugn atmosfär. Jag rekommenderar starkt. Stephanie är alltid trevlig och hennes behandlingar väl gjort.",2
"Köpte rabattkantskydd i Cortenplåt, 5 delar. Tyvärr saknades en mutter till en skarvdel, i leveransen.",2
Fönstertvätt: De skulle ha me sig all utrustning som behövdes enligt deras egen utsago. När de väl kom bad de om diskmedel mm. Hade diskmedel men inte annat som behövs. Resultatet blev inte speciellt bra. Kommer inte använda dem igen.,0
Väl bemött. Bra information och råd. Proffsigt.,2
"Bra priser, otroligt god mat och trevlig restaurang som varmt rekommenderas.",2
"Varning, varning.......!!!!! Har aldrig varit med om sämre utfört jobb. 6 åring med snickar glädje hade fått ett lika bra eller bättre resultat.",0
Ett fantastiskt bemötande av en mycket kunnig mäklare som inger stort förtroende. Kontaktar henne gärna igen.,2
"Som tidigare trevligt bemötande o utmärkt mat, denna gång skaldjursfat o små förrätter samt mycket god efterrätt, min son som är utbildad kock var mycket imponerad. Kommer gärna tillbaka",2
Vill man få jobbet gjort? Anlita inte dom här. VARNING ,0
Personen i fråga tog inte min smärta på allvar. Ger inte så seriöst och ödmjukt intryck.,0
Bemötandet och kontakterna var naturliga från början. Bra att han tryckte på vikten i den juridiska processen. Bra tips inför visningen Kanske lång process till visning.,2
Hemfrid hjälper mig att ha fint hemma!,2
"Väldigt nöjd med Martina som är lyhörd, flexibel och väldigt trevlig. Man märker snabbt att hon är en van och kunnig frisör. Rekommenderas varmt!",2
"Sålt villa, vänligt och korrekt bemötande. Mäklaren tog väl hand om allt bra med återkoppling via mail och mobilt. Kan varmt rekommenderas.",0
Fantastiskt bra bemötande och behandling. Kan varmt rekommendera Louise!,0
Städningen gjordes inte klart det var dubbelkobat. Flyttkillar kom sent soffa gick sönder fakturan fel och därefter sändes den till fel adress. Kommer inte anlita hemfrid igen eller rekommendera hemfrid,0
Flytten avlöpte smidigt. Bra dialog unde dagen och lätt att hitta lösningar när behov av anpassningar uppstod. Anlitar dem gärna igen.,2
Jag blev gott bemött och fick hjälp ang bågar. Jag gjorde synundersökning och personalen var jättetrevlig,2
"Riktigt dåligt, maten är dålig (dem kommer in med vagnar med mat, bär altså inte ut maten själv), dem har den pinsammaste musiken och showen - riktigt oprifsiga showdansare.",0
"Under ett års tid har han varit min mäklare och det har varit så skönt att någon som är trygg, professionell och trevlig vid sin sida när man ska ta ett sådant stort beslut som att sälja sin lägenhet. Daniel är grym. /Madelene Pettersson ",2
Marredo rekommenderas INTE. De är bara ute efter att tjäna pengar.,0
