Stockholiana på köpet!,2
Kan varmt rekommendera Victoria Akademin. Har varit och fått mina fransar fixade ett par gånger av  både Victoria Moa o Kia och är lika nöjd med alla tjejerna.,2
Har varit i kontakg med dem för att få e-faktura !! Detta har ej lyckats trots flera påstötni ngar. Riktigt dåligt.,0
Däckbyte. Muttrar byttes inte trots info om detta. En mutter var sen sönder och fick bytas av annan verkstad till dyr kostnad,0
"Mäklare lovar mycket men gör inte hälften  Heller och det som är bra för sin del glömmer aldrig  men från kundens sidan ,de får Alzheimer plötsligt .",0
Perfekt jobb levererat enligt plan Tack,2
"Trevlig personal, dock trodde jag att det skulle vara mer show. Det som var klart sämst var att vi blev placerade längst en ""långbänk"", typ som att sitta längst en bar, fast utan själva baren... ",0
Har inte köpt något eftersom jag hade grå starr. Återkommer till er när dom har opererat ögonen  om jag behöver glasögon.jag fick jättefin service. Jag tänker rekommendera er om någon frågar. Tack för hjälpen Anna roll . ,2
Superbra bemötande från första till sista stund. Väldigt bra upplärning av lärarna där (jag hade Marita) och tog körkortet efter 3 lektioner även fast jag blev rekommenderad 10 från början.,2
"Kunde inte vara mer nöjd,trevligt bemötande från dag ett.kunnig,proffesionell och mycket bra på sitt jobb! Kan varmt rekommenderas.mina förväntningar är uppnådda plus lite till :)",2
Bra service och mycket professionella.,2
"Bra bemötande men bilen jag köpte var inte i det skick som de beskrev, mängder av fel så sluomdömet mitt blir dåligt.",0
Professionell och ett bemötande som tilltalar.,2
bemötandet var bra men reparationen ofullständig. skrapskydd saknades och jag väntar fortfarande på tid för återbesök.....,0
Köksluckor blev bra bemötande av säljaren och en duktig montör så resultatet blev jättebra,2
"Jag tyckte de var varsamma om mina möbler. Arbetade som ett team. Nu var det några månader sen jag flyttade dock,, 25 september. Vänligen Martina",2
Trevlig personal och god mat! Super!,2
"Jag köpte en lägenhet och han var väldigt lugn, saklig och proffsig och han höll mig uppdaterad under budgivningen.",2
"Qicon har alldeles nyligen totalrenoverat vårt badrum och lyckats få till ett verkligen vackert sådant, dessutom blev det klart på utlovad tid! Jan B",2
Flyttstäd som utfördes snabbt och proffsigt utan anmärkningar. Vi kommer definitivt anlita makeclean nästa gång också.,2
Smidig leverans. Vacker gran. Goda pepparkakor. Helt enkelt - strålande! Tack!,2
Det tog 10 dagar att få min beställning samt var lacken avskavd på flera ställen på ljusstakarna🙁,0
"The restaurant is nice, but the food is really basic.. beef dishes are better than the fish dishes. Fish was missing all the spices, including the salt and the vegetables were burned.",0
Just nu kan jag inte rekommendera LCV lagat bromsar för massa pengar och sen bli underkänd på besiktning uselt😝,0
Köpte varmvattenberedare inklusive installation. Troligen inte billigast men bra bemötande och bra jobb.,2
Min Bil Haninge är en bilverkstad med professionell framtoning och ett gott kundbemötande. Ett bra alternativ till en märkesverkstad!,2
Han ingav en lugn och trygg känsla. Pushade inte på. ett bra och trevligt bemötande.,2
Otrolig att mekanikern fick sitta en vecka i kundmotagningen istället för att laga min bil. Dåligt att inte kunna erbjuda reservdelar till lägsta pris. Jag köpte själv in reservdelen under halva priset.,0
Superduktiga! Lyhörda och ödmjuka. Grymma på alla sätt och vis! ⭐️,2
"Köpt en Nissan Leaf 2014. Trevligt bemötande och service. Hade dock önskat att kunskapen om elbilen varit större. Fick höra att vi sannolikt kunde resa hem på laddningen, vilket inte alls stämde.",2
Supertrevlig och snabb kontakt. Bra pris. Kvalitet till 100%!,2
Mycket duktig frisör /barberare. Har provat flera i Sthlm och detta är den jag återkommer till 👍,2
"Väldigt nöjda med flyttstädning - bra kommunikation, grundligt utfört, smidigt. Rekommenderas!",2
"Hade ”nackskott” o axelvärk som på två behandlingar vände och blev bättre. Jag kommer definitivt att besöka kliniken igen, vid behov eller bara för uppmjukning av stela muskler. Proffsigt bemötande och starka nypor :)",2
Alltid vänligt bemötandepå praktiken. Känner mig trygg.Upplever att det finns ett gediget kunnande. Har aldrig haft någon anledningar tvivla på om jag fått rätt behandling eller ej.,2
Trevligt bemötande av Lotta som ringde och informerade om kostnader för bilen utöver det som var beräknat.Mycket trevlig personal!😊,2
Besviken på paketet jag köpte och blir otroligt irriterad på sådant här,0
Tog betalt 3166kr för 10 minuters jobb. Tillämpade jourtaxa trots att inget jour- ärende  Undvik!,0
"Det har inte levt upp till mina förväntningar elak och dålig lärare i ansiktsbehandling, anatomi och make up.",0
Större uppmärksamhet borde riktas mot kunderna och mindre interna samtal mellan de anställda.,0
Allt fungerade bra. Christoffer hjälpte till när det behövdes och svarade på frågor. Jolanta i receptionen har också varit en stjärna i processen.,2
"I did highlights and extensions with Catherine. She is always professional, with a great taste and needed advices. I will truly recommmend her services.",2
"Grymt bemötande, riktiga detektiven när det gäller lösningar på ryggsmärtan, toppen helt klart.",2
Blir alltid vänligt bemött. Professionell och gedigen upplevelse. Mycket familjärt.,2
Mäklaren som vi skulle träffa skickade en medhjälpare istället. Hon var inte insatt i objektet varpå vi inte fick svar på våra frågor till fullo.,0
Tandvård Utmärkt snabbt ordnat för akut behov. Nu missarde jag ett återbesök pga Corona viruset.,2
"Tog alldeles för lång tid för att få frukost och dessutom var vi helt ensamma i restaurangen, annars bra mat.",0
Minns inte vad jag hade för ärende. Blir alltid bra bemött. Behöver jag hjälp med rörmokeri så har jag ett förstaval.,2
Trevlig och bra montör men där stannar det positiva. Saknar helt skrupler när det gäller det ekonomiska. Blir ingen rekommendation från min sida.,0
Kundmottagaren anlände rejält försenad trots inbokad tid och flera telefonsamtal.,0
Intressant och givande kväll med bra diskussioner! Bra och pedagogiskt upplägg!,2
Jag rekommenderar Carima varmt. Alla parter nöjda efter en smidig affär.,2
Otrolig upplevelse. Mina gäster från Polen var så positiv överraskade !,2
"Vänligt och mycket professionellt bemötande och rådgivning i samband med en omdragning av ventilation mellan badrum och kök i lägenhet. Arbeetet bestod av ventilationstrummer, håltagning i väg, visst el jobb och ned- samt upp montering av delar av köksskåp. Utmärkt fakturarutin.",2
Det va inte speciellt bra då det va många buggar och tråkigt.,0
"Företaget lever på att göra utmätningar på redan betalda skulder. ""Betala skulden, annars får du utmätning hos UC"", riktigt blufföretag.",0
"I didn't received the package yet, what is the response I'm supposed to give",0
Beställde en storstädning. Allt blev mestadels väldigt rent och fint men några ställen som borde ha ingått verkar ha blivit missat.,2
Alldeles för dyrt och inkompatibla bilmekaniker,0
Min Städare Stockholm putsade fönster och utförde städning till stor belåtenhet. De är seriösa och proffsiga.,2
Beställde en banderoll för över 3000 den var skadad när den kom och kag skickade ett mail med bild men får inget svar när jag mailar. Tråkigt!,0
Jag fick en produkt som var skev och jag har skickat mejl till Sveabad men inte fått något svar. Även fast det är semestertider så borde det ändå finnas någon som svarar på mejl. Dåligt!,0
Jobryan var hos mig för att diskutera en badrumsrenovering och lovade att återkomma med offert vilket aldrig kom. Angelo gav mig inget bra intryck. ... Oseriöst företag.,0
"Snabb och tydlig kommunikation. Trevlig, proffsig, snabb hantverkare på utsatt tid. Rimlig kostnad.",2
Bjöd några vänner på lunch. Maten var en riktigt tråkig kålpudding som inte mötte våra förväntningar. ,0
"Snabb på att skicka fakturan, gjorde det samma dag som beställningen. Nu en vecka senare har det fortfarande inte kommit nån produkt.",0
Sluta skicks påminnelser... trötsamr,0
Håller helt med Anna R...kommer aldrig att besöka resturangen igen,0
"Oerhört proffsiga och lättillgängliga, rekommenderas varmt!",2
"Lovar ett pris men kommer sista dagen, deadline för oss och meddelar att de inte kan hålla priset. Dessutom mycket dåligt städat!",0
Min Bil Analyserade och fixade amina airkondiotionerings problem.,2
Asiatisk buffé med all klassiskt flott och sötslisk man kan tänka sig.,0
Usel produkt. Returen kostade mig nära 70 kt porto. Men fick ett vänligt svar på mitt klagomail,0
Totalt sett vill jag ge företaget högt betyg. Från första kontakt var det ett mycket seriöst hanterande från mäklarens sida. Det stämde från början till slut och det mäklaren sa stämde i allt väsentligt. Jag tycker det gav ett mycket seriöst intryck och skulle fråga samma företag om jag säljer lägenheten.,2
Ville oxå VARNA för denna skojverkstad !! Enda hjälp man får efter deras missar att man får vända sig till ARN ! Dålig service !!! Och BEDRÖVLIGT utfört arbeten ! ALDRIG mer denna sk verkstad.,0
"Trevligt ställe, god mat, trevlig personal men blev inte mätt. Den veg portionen var alldeles för liten.",0
"Entren öppnade väldigt sent. 100 personer stod och väntade, troligen pga att vi vid bokning fått order om att vara i mkt god tid. I övrigt god mat, bra service, bra föreställning ",2
Sålde bostadsrätt på distans Allt fungerade bra,2
Tyvärr slarvas regelbundet med städningen och man har glömt att låsa/larma vid ett flertal tillfällen,0
"Duktiga, engagerade och ligger i den undre delen när det gäller arvoden.",2
"Snabb och trevligt service. Fixade allt på en timma, trots att jag inte bokat.",2
Saklig och lugn mäklare . Förtroende givande . Bra och snabb affär,2
"Kan tyvärr inte alls rekommendera detta företag. Det städades inte rent utan fick bli backning på städningen, det kostade mer än vad som från början var överenskommet, det slängdes saker från lägenheten utan att de frågade. Väldigt besviken.",0
Jag har beställt hem glasögon för att prova ut och ska undersöka ögon i veckan. Har fått snabb hjälp både via chatten och i butik. Blev rekommenderad Nividas och de har överträffat de förväntningarna som jag hade.,2
Skulle beställa några fina klänningar jag sett i en katalog jag fått hem i posten. Skulle beställa dagen efter jag fått katalogen och då var varorna redan slut! Uruselt!,0
"Enkel hantering, trevligt bemötande, schysst deal.",2
Hej! Jag köpte en ford bil och jag hittade företaget via blocket. Jag är nöjd,0
"opersonligt, skickade hem en städare till oss som vi uttryckligen sagt att vi inte ville skulle återkomma. Åt lunch under städtiden.",0
"Inkoppling av spishäll + ugn. Super smidigt, hade tid med kort varsel, bra pris.",2
Köpte startrelä till 4-hjulningen på eran hemsida. Snabbt enkelt o bekvämt vid beställningen. Jättesnabb leverans av er👍👍,2
Allt fungerar väldigt bra och vi är väldigt nöjda med städet.,2
Mycket lyhörd och professionell. Tydlig och ödmjuk.,2
Vi fick ett bra och snabbt bemötande av mäklaren när vår övernattnings lägenhet skulle köpas.,2
"Jag köpte en ny bil och jag är super nöjd med hela affären, väl bemött och omhändertagen! Skulle gärna rekommendera dem! ",2
Trevlig och kompent personal med ett bra och tydligt bokningsflöde.,2
Beställde flyttstäd. Oseriöst bemötande och svårt att få kontakt med rätt person angående när de skulle komma.  Kommer inte att anlita igen.,0
Hemsk upplevelse. Skulle byta koppling o han försökte dessutom få mig att tro att växellådan var tvungen att bytas trots att den var helt felfri enl andra verkstäder. Bedrövligt.,0
Motorskydd. Mitt försäkringsbolag anvisade mig till Min Bil. Undersökningen tog längre tid än uppgivet och de återkopplade inte utan jag fick åka dit och fråga vad som hänt. Lagade bilen men efter någon vecka var felet tillbaka. Nu är bilen inlämnad där igen.,0
Hon som skulle utföra sin behandling på mig misslyckades. Erbjuder sig att boka in en tid veckan därefter. Tar ändå betalt för det misslyckade besöket!,0
Minst sagt ohövliga mot omgivningen. Anlita endast om vi vill bli osams med dina grannar.,0
Sofia Bergström var mycket trevlig och utförde arbetet professionellt. Hela ärendet har utörts utan minsta problem. MVH Astrid Widén ,2
Jag är jättenöjd - jag har avtal om fönsterputs och de kommer när de ska och jobbar snabbt och effektivt med bra resultat!,2
Köpte en bil från Bilförmedlingen i Helsingborg.  Gick jättebra.  Bilen är fint och servicen var bra.,2
Mex ombesörjde min flytt och det var verkligen massor med grejor. Trots det gick det förvånansvärt smidigt. 3 flyttkarlar arbetade lugnt och metodiskt - hela tiden på gott humör. Sammanfattningsvis: OM jag ska flytta igen ringer jag Mex i första hand- ,2
Bra service anda samt snabbt arbete med alla stubbar,2
"Bra service. Trevlig och kunnig personal. Lämnar gärna min ""pärla"" i deras händer.",2
Jag upplever Goel dom ett mycket seriöst företag. Jag har inte  behövt kontakta dem utav jag betalar mina fakturor via autogiro.,2
Väldigt nöjd med Karolin! Hon är mycket engagerad och alltid tillgänglig vilket vi uppskattade väldigt mycket. Hon är också lugn som person och vet vad hon gör.,2
Det är fantastiskt att komma hem till nyputsade förnster,2
blev inte alla lika bra som första gången vi gjorde det märks ingen skillnad alls,0
Vi har veckostädning varannan vecka och är mycket nöjda. Pålitligt företag med god kvalité. Information och kommunikation fungerar bra.,2
"Glad, intresserad, noggrann och lyssnande en mäklare som verkligen passar för sitt jobb.",2
"Mycket kunnig, professionell, lättsam och pedagogisk man som höll i utbildningen. Kommer rekommenderar andra att gå just hit!",2
Det kunde bli lite bättre Säljerna var inte riktig följer sin uppdrag,0
Bra service korta väntetider m.m. säljarna mycket kunniga.,0
Vi var jättenöjda med båda flytthjälp och städningen. Jättetrevliga flyttgubbar!,2
De var sena och visste inte hur gps fungerar. Vilket resulterade i att de åkte vilse påväg till min gamla lägenhet och åkte vilse till min nya. Jag hade en inbokad hisstid som vi gick över tiden med pågrund av bristen i gps kunskaper. Men de var duktiga på att städa,0
"Trevlig, duktig och ställer alltid upp. Tack vare det fick vi ett jättebra slutpris vid våran försäljning.",2
"Både sålt och köpt. Bra, personligt och engagerat bemötande. Bra tillgänglighet på mail och sms för övrigt.",2
"Naglar, Otroligt duktig och noggran, mycket nöjd. Mycket trevligt bemött, rekommenderar verkligen Sanna :-)",2
Effektivt och professionellt bemötande vid bygge av altan/uteplats. Snabbt genomfört arbete med mycket gott resultat. Kan absolut rekommenderas.,2
Hos Sundelins Fotvård får du ett vänligt bemötande och proffessionellt utförda behandlingar.,2
Väldigt bra men hade jag fått information istället för att ställa massa frågor hade det varit en något bättre kundbemötande. Ingen information eller skötselråd fick man heller men eftersom jag hade läst på lite själv ställde jag själv frågor.,0
Smutsiga väggar. Dåligt installerade golvremsor. Dåligt belägna lameller vid dörren. En skadad golvplatta placerades. För korta skruvar i remsorna som förbinder golvpanelerna.,0
"Jag har sålt liten villa i Kinna. Peter är kunnig, informativ och trevlig. Jag är mycket nöjd med samarbetet.",2
"Rune är död ! Det var anledningen till att vår mor, pappa Runes fru sålde stugan. Det ska ni ha koll på. Är därför förundrad att ni sänder ut denna fråga. Det blir därför sämsta betyg till er alla. Mvh Sonen Göran",0
"Trevliga, tillmötesgående, flexibla personal. Beställde fönsterputs. Mycket nöjd av arbetet.",2
Jag har sålt fritidshus och tycker att allt har gått smidigt hittills. Affären slutförs nästa vecka. Jonas har varit hjälpsam och svarat på de frågor jag haft.,2
Tillmötesgående uppriktig ärlig och trevligt bemötande kan rekommenderas absolut!!,2
Värmepannan gav felmeddelande och värmde inte som den skulle. Både service och felsökning 1 missade felet som felsökning 2 upptäckte: att det hade brunnit i pannan.,0
Lite trist att lägga pengar på en rotfyllning av tand som ändå i slutändan  behövdes dras ut Mycket smärtsam tandutdragning och värk efteråt,0
"Julbord 2014 och 2015. Fantastisk miljö, god mat (bra med så många olika alternativ), trevligt bemötande. Trevligt med berättad historia vid entrén.",2
"Lars levde upp till alla förväntningar! Kunnig, proffsig och trevlig!",2
Fantastisk effektiv och behaglig behandling av Louise som är väldig skicklig och kunnig.,2
Såväl supertrevliga som otroligt kompetent personal med otroligt fina resultat varje gång. Jag är och kommer fortsätta vara en återkommande kund!,2
Jag har haft IBK hos mig ett par gånger nu för måleri och tapetsering. Jag är otroligt nöjd med resultatet och vad dom lovat map tid pengar.,2
"Vi är jätte nöjda med Strandstadens, dem renoverade vårt badrum samt kök. Vi fick ett fast pris, under renoveringen tillkom lite småextra arbeten som dem fixade gratis. Rekommenderas",2
Underrede behandlade bilen God service trevligt bemötande,2
Lamt och oengagerat från serveringspersonalen. Tråkig mat. Tänk att ha en så fin plats att kunna göra så mycket med och inte göra något alls. Trist. Kommer tyvärr inte återkomma.,0
Riktigt skitföretag. Tog betalt för två timmar när tog en kvart. Ett jobb som inte ens blev som det skulle. UNDVIK!,0
Mycket missnöjd Ingen sa man debitera 2 timmar minimum för ett jobb som tog 10 min 4000 kr Hutlöst Dyrare timtaxa än en neurokirurg!,0
Kundtjänst var lätt att nå och med smidig hantering av mitt ärende.,2
Säljaren stod inte för kostnader som han lovat.,0
Vilken otrolig snabbhet! Har renoverat kök och som alltid missar man något. Handtag! Beställde den 29/10 och paketet kom den 30/10. Fantastiskt! Vilken service! Hyggliga priser oxå!,2
"Nja. Vi fick inte vara kvar för vi drack lite fort, hade förbetalt både mat och dryckespaket men allt ”brann inne”. Ingen återbetalning. Väldigt trist av en seriös aktör.",0
"Har köpt olika slags fotvårdstjänster hos Gun-Marie. Trevligt bemötande, professionellt utförande, goda tips och råd. Levde helt upp till mina förväntningar. Lätt att boka tider.",2
"Köpte flytthjälp och det fungerade perfekt. Bra hanterat, inga skador, snabbt och effektivt. Helt klart prisvärt.",2
"Mycket trevlig personal, snabb och bra service och riktigt god mat till rimligt pris.",2
Byte av turbo på Merceds Sprinter Vänligt bemötande. Inkompetent kundmottagare och mekaniker som inte kunde bedöma eller utföra jobbet.  Debiterar kostnad trots att mekaniekrn vid avhämtandet meddelar att de inte klarar att utföra arbetet. ,0
Känner mig lurad. Färgen framgick inte bra på kudden o när jag skulle sända tillbaka den så kostade returen 80 kr för ett kuddfodral. Lurad. Valde vit kudde men fick blå,0
Ganska trist ton på dem när jag inte ville fortsätta förvara mina däck hos dem.,0
"Köpte mig en Volvo v60 2017 Och är super nöjd med bilen, Trevlig och kunnig personal Här kan jag verkligen köpa bil igen Rekommenderar starkt denna firma  Mvh Eric ",2
Snabbt hanterande av ett litet - men jobbigt - problem som drabbade min bil. Betydde mycket för mig - där och då.,2
Hej Joe! Jag har försökt nå dig sedan i Oktober. Du har fortfarande mina nycklar! Lever du?!,0
"Klippning, tvätt och färgning av håret. Fransfärgning, ögonbrynsplock, handvård och nagellack. Trevligt bemötande på ett personligt ej påträngande sätt. Vänlig personal som tar sig TID (ha ha). Bra produkter och proffesionellt i allt.",2
"Jag fick hjälp av Mahr med besvär för rygg, axlar och strålning. Jag blev väldigt väl bemött. Få hjälp med ryggen vilket jag fick. Mahr är toppen och har hjälp mig otroligt mycket med behandlingar.",2
"Den värsta mäklaren , hon var inte ärligt med informationen .",0
Tjänst/varor: Synundersökning Kontaktlinser Mycket vänligt och professionellt bemötande av kunnig personal. Ett företag är ingenting utan bra personal. Personalen får toppbetyg!,2
"Toppenbra bemötande, alltid med utgångspunkt att jag visste vad jag pratade om och med inställning att lösa alla ev problem. Helt ok hantverkare som också var hyggligt noga. Lyssnade också på synpunkter och idéer. Mycket bra. ",2
Inglasad balkong. Blev som ett extra rum!  Jobbet utfördes snabbt smidigt och alldeles utmärkt. Vi är mycket nöjda😊,2
Äcklig Rhode Island dressing. .förstörde salladen totalt.  Aldrig mer detta ställe!  Bläää,0
"Bland det roligaste jag har gjort, så mycket adrenalin och gjädje!",2
Mycket nöjd. Det blir ju inte perfekt första gången men med en ekel och tydlig dialog får jag verkligen allt jag vill ha.,2
Fantastisk mat och sevice. Lokalerna är också jättemysiga.,2
"Ganska liten och intetsägande lokal, men med ett magnifikt utbud av elektronik och datortillbehör. Trevlig och kunnig personal som gärna hjälper till att hitta rätt saker. Tyvärr tidvis ganska så lång kö, men den rasslar på ganska snabbt i alla fall.",2
"Slltid bra service, rena o välputsade fönster o bleck när man kommer hem!!!",2
"Har haft godel många år, har fått många av mina bekanta att byta till godel, Bra bemötande, hushållsel.",2
Den bästa fotvård jag haft. Väldigt trevligt bemötande och bra råd.,2
"Snabbt, enkelt och tydligt med superbra resultat. Varmt rekommenderat.",2
"Köpte en bil och blev väl bemött, kanon service och en fin Volvo s60 blev det för mig :) kan varmt rekommendera TDH BIL.",2
Fantastiskt proffsigt bemötande från dag ett. Vi är mer än nöjda från A-Ö,2
Mycket bra företag och är det nåt som inte stämmer löser dom det snabbt,2
Bilservice. Fick ingen info när bilen var klar att hämta. Personalen försökte debitera ett högre belopp än vad som offererats. Ingen genomgång av serviceprotokollet. ,0
"Ni har hjälp oss att flytta, flyttstädning och storstädning av vår lägenhet 2 gånger. Allt har fungerat mycket bra och vi är mycket nöjda",2
Jag har städning varannan vecka vilket funkar jätte bra!,2
Mycket bra service Smidig affär Schysst Saab verkstad i samma hus,2
"Om det var ni som städade hos mig, vet jag inte, jag vet inte vilket företag det var som var här. Oavsett , så trodde vi att Samhall hade varit här och städat, toan var fruktansvärd  bla...  Så tyvärr !!! Inget jag kommer att rekommendera någon  Mvh ",0
"Ros: Trevligt bemötande, försiktig hantering av mitt material och justerbar tidsplan Ris: Sen ankomst, lågt arbetstempo och felberäkning på tidsåtgång (som löste sig då jag fick övertala dom om den faktiska tidsåtgången) ",0
Installation av luftvärmepump. Trevlig och serviceinriktad installatör med goda råd och lösningar av praktiska hinder.,2
"Jag köpte däck på fälg Jag blev guidad till rätt storlek och hade flera val, fick snabb leverans och är mycket nöjd med företaget",2
Dammsugarpåsar. Allt var bra utom att inte tog enstund att hitta rätt påse,2
"Städning ok men inte mer; dålig kommunikation från administrationen, dåliga på att svara etc.",0
Ingen kundtjänst att ringa till. Uselt. Numret är inte i bruk.,0
De bytte en vattenutkastare utomhus. De kom på ett par dagar och läste det snabbt!,2
Kunnig personal och proffsiga råd hur jag ska träna (artros i knä).,2
Köpt nya bilar allt funkade ganska bra många samtal fram å tillbaka har ej fått leverans av bilen men så här långt är det ok,2
Köpt parhus i Tungelsta av Lynn. Fick direkt ett väldigt trevligt bemötande och är väldigt nöjd med den hjälp som vi fått. Bra mäklare och genuint trevlig person.,2
Dåligt städat fast dom bytte ut städarna. Många saker gick sönder / blev förstörda. Försökte skriva fler timmar än de jobbat. Rekomendteas INTE,0
Fick hjälp med flyttstädningen och jag är jätte glad att jag köpte tjänsten hos er. Ni gjorde mer än förväntat och det blev jätte fint. Värt varenda öre 😊👍🏻,2
Spraytan som blev perfekt och väldigt trevligt bemötande!,2
Vi köpte en bostadsrätt via Husman Hagberg. Bemötandet vi fick var fantastiskt. Vi kände oss väldigt omhändertagna och trygga med affären. Var det några frågor kunde man räkna med att få dessa besvarade snabbt.,2
"Flyttning av bohag från hus till lägenhet. Trevliga, flitiga män som slet med många flyttkartonger. Fick jobba fler timmar än beräknat. Nöjda med deras arbete.",2
Köpte firmabil där Jonas med stor erfarenhet och trygghet hjälpte mig genom processen. Rekommenderas varmt !,2
Skandal Mäklarna!,0
"Ordning o reda, stort servicemedvetande och bra priser. Rekommenderas verkligen.",2
"Undermålig, ofta utebliven städning. Ingen respons när detta påpekades. Vid telfonkontakt med ""företaget"" är bemötandet allt annat än professionellt, rentav otrevligt. Rekommenderas ej!",0
Jag blev väldigt bra mottagen i butiken och fick jätte bra hjälp när jag skulle välja säng : Dom motsvararde på mina förväntningar,2
"Bra service vid själva bilaffären, men inte sedan. Lämnade in bilen på felsökning på en Meca-verkstad som sedan försökte få tag på försäljare i Östersund. Det var svårt, så till slut gav de upp.",0
