sentence_column_name|tag_column_name
GyPSii mobila sociala nätverksapplikation är tillgänglig i Kina med stöd för både kinesiska och engelska.|1
Storbritannien registrerar noll Covid-dödsfall för första gången på över ett år|2
Som tidigare meddelats ingick GeoSentric Oyj finansieringsavtal med sin huvudinvesterare den 30 juni 2010 som gör det möjligt för Bolaget att erhålla finansiering upp till det sammanlagda beloppet av 6 miljoner.|1
De nuvarande permitteringarna kommer utöver de tillfälliga permitteringarna som avtalades i december 2008 och i maj 2009 .|0
Det Hayward, Kalifornien-baserade målet designar aktiva, vardags- och klänningsskor, samt stövlar och sandaler.|1
Han förväntar sig dock att bankerna tillhandahåller alternativ finansiering.|2
För närvarande bygger YIT ett bostadsområde Zapadnye Vorota på 26 000 kvadratmeter i staden och ett hus på 9 910 kvadratmeter, som kommer att stå klart i slutet av 2009.|1
- Tikkurila inspirerar dig att färglägga ditt liv.|1
Von Koskull kommer att övervaka en ny enhet inom Nordea, som samlar affärsdivisioner för affärsbanker, finansinstitut och kapitalmarknadsprodukter.|1
Leveranser av Outotec kommer att ske över 30 månader.|1
Därmed kommer företaget att utöka sitt erbjudande till Nord-, Central- och Sydamerika.|2
HSBC tar 3 miljarder dollar i förluster på försäljning av orolig fransk bank.|0
Cargotecs varumärken Hiab, Kalmar och MacGREGOR är globala marknadsledare inom sina områden och deras lösningar används på land och till sjöss – varhelst lasten är på väg.|1
Sydkoreas BNP Q1 slår förväntningarna på investeringar, exportstuds|2
Värdet på beställningen är 4 miljoner euro.|1
I Asien-Stillahavsområdet är Visa Wave tillgängligt i Malaysia, Taiwan och Sydkorea och kommer att utökas till Japan och Sydostasien i år, tillade Jung.|2
26 januari 2011 - Den finska mjukvaruleverantören Basware ( HEL : BAS1V ) sa i går att de justerade sin strategi och mål för de kommande fyra åren med fokus på internationell tillväxt främst genom förvärv .|1
Slakt och styckning av nötkreatur vid Kuopio-anläggningen överförs till slakteriet i Kauhajoki.|1
Bolaget kommer att publicera sitt bokslut för 2008 den 25 februari 2009 .|1
Hans avgång träder i kraft omedelbart.|1
Man har sålt hälften av sin affärsverksamhet och kommer in på Helsingforsbörsen via bakdörren genom ett innovativt buyout-arrangemang med Kasola.|1
Pentik+Æinen betonar att det mesta av internetinnehållet som mediahus tillhandahåller inte kan vara gratis för alltid.|1
Nokia Corp of Finland meddelade i tisdags att de har fått ett enhetligt enhetshanteringskontrakt med den finska operatören Elisa Oyj.|1
Finsk-svenska TietoEnator expanderar sin verksamhet snabbt i Ryssland .|2
I april-juni 2008 uppgick Scanfils omsättning till 58,7 miljoner euro och rörelsevinsten till 6,6 miljoner euro.|1
ECB kan främst rikta inflationen.|1
Han kommer att rapportera till CapMan Plcs vd Heikki Westerlund.|1
Arbetstillfällen kommer dock inte att flyttas från Finland.|2
pct lägre på 4 442,10 .|1
Byggnaden kommer att inrymma till exempel Respecta Oy:s lokaler i Jyväskylä, samt andra företag som kommer att tillkännages senare, säger Samuel Koivisto, direktör för Technopolis-verksamheten i Jyväskylä.|1
HUHTAMAKI OYJ BÖRSMEDDELANDE 16.12.2008 KL. 09:30 Huhtamaki Oyj har beslutat att förtydliga koncernstrukturen genom att separera Foodservice- och Consumer Goods-verksamheterna i sin produktionsenhet i Hameenlinna, Finland genom att överföra verksamheten till sina helägda dotterbolag.|1
För att säkerställa låga driftskostnader för radionätverk kan BTS-modulerna konfigureras, mjukvaran uppgraderas och diagnostiseras på distans.|2
Bolaget kommer att föreslå en utdelning på 0,12 EUR per aktie för 2008 .|1
Avtalet utökar Tekla Structures användningsområde till brodesign.|2
Vi har gjort långsiktiga investeringar i att utveckla systemets implementeringsmodell.|1
Nokia och Capcom meddelade att Resident Evil Degeneration kommer att släppas på N-Gage senare i år.|1
Operatörer behöver bara lära sig hur man använder en enhet för flera nivåer av applikationer, inklusive röststyrda operationer.|1
Leverans startar omedelbart i juni 2008 och kommer att slutföras under 2008 .|1
Linje 4 kommer att gå helt under jord och kommer att omfatta 10 stationer som kommer att utföras i två genomförandesteg.|1
Brittiska företag ringer efter hjälp när pandemirestriktioner utökas.|0
Betydelse : Teleste har betonat att Polen med sin stora storlek och växande ekonomi , samt den snabba utvecklingen av sin distributionsindustri för TV - tjänster , ses som en attraktiv marknad .|2
Utöver efterfrågan i Finland ökade även exporten av foderstensprodukter.|2
Som ett resultat kommer ett 20-tal personer inte längre att behövas.|0
Marknadsvärdet för en kran är cirka 6 miljoner USD, rapporterade den finska nyhetsbyrån STT.|1
Ekonomiska villkor offentliggjordes inte.|1
Den nya Kroksbergs järnvägstunnel kommer att byggas på en ny spårsträcka mellan Härnösand och Veda, som ingår i linjen som följer Bottenvikens kust.|1
Alla är välkomna .|1
Rapporten fortsätter med detaljerade profiler för tio ledande europeiska specialkemikalieföretag och korta profiler för andra stora aktörer.|1
Teklas mjukvarulösningar gör kundernas kärnprocesser mer effektiva inom byggnad och konstruktion, energidistribution, infrastrukturhantering och vattenförsörjning.|1
Den kommer att redovisa helårsresultat den 22 augusti.|1
Rörelseresultatet var 11,4 miljoner euro , en ökning från 7,5 miljoner euro .|2
Dotterbolaget kommer att ansvara för filterförsäljning, lokal montering av filter och eftermarknadstjänster i Kina.|1
Den finska investeringsgruppen Panostaja Oyj sa att dess nettovinst steg till 8,6 miljoner euro 11,4 miljoner dollar under räkenskapsåret 2005-06, som avslutades den 31 oktober 2006, från 2,8 miljoner euro 3,7 miljoner euro under samma period 2004-05.|2
&quot;Mycket att rekommendera&quot; är Nokian Z G2 enligt &quot;ADAC-domen&quot; i det senaste sommardäckstestet av den tyska bilföreningen ADAC.|2
Det slutliga priset kommer att specificeras senast den 14 maj 2010, sade det förvärvande företaget.|1
Alibaba leder investeringar på 400 miljoner USD i detaljhandelsjätten i Vietnam|1
Nya produktlanseringar i Finland kommer att mer än fördubblas från 2005 .|2
BasWare Invoice Processing, BasWare Contract Matching, BasWare Order Matching och BasWare KPI Reporting Tool är en del av BasWares Enterprise Purchase to Pay-lösningssvit.|1
Både rörelseresultatet och omsättningen för niomånadersperioden ökade från 2,4 MEUR respektive 43,8 MEUR jämfört med motsvarande period föregående år.|2
Kina står inför sin värsta strömbrist på ett decennium. Det är ett problem för hela världen.|0
Tidigare president Trump besöker södra gränsen|1
Känd som Post Bank, skulle konceptet innebära att Fidelity Bank rullar ut 75 kontor i Ghana Posts lokaler för att tillhandahålla finansiella tjänster till folket.|2
Banken undersöker också fördelarna med att överföra den svenska verksamheten till filialkontor för att verksamheten ska styras av Finlands lagar.|1
Nätverkstestverksamheten är en del av Elektrobits affärssegment Test och Automation och sysselsätter 39 personer i Finland och 22 personer utomlands, främst i USA och Asien.|1
Finska GeoSentrics omsättning minskade till 939 000 euro i januari-mars 2009 .|0
Det totala värdet av projektet värderas till 30 miljarder SEK (2,83 miljarder EUR 3,81 miljarder USD).|1
Dessa modulprodukter kommer att finnas tillgängliga för tester under 3Q-07 och för volymleveranser under 4Q-07.|1
Omkostnadsprocenten var 102,6 % jämfört med 92,9 % motsvarande period 2005 .|0
Rörelseresultatet sjönk till 20,3 miljoner euro från 74,2 miljoner euro andra kvartalet 2008 .|0
Rörelseresultatet steg till 27,8 miljoner euro från 17,5 miljoner euro 2008 .|2
Viking Lines chef Jan Kaarstroem sa till TT att hans företags färjor var väl rustade för att hantera is och att alla passagerare var säkra.|2
Händelsen inträffade klockan 14.30 på Avenue 192 vid väg 196 .|1
Comptel Corporation Sami Ervio VD och koncernchef, distribution: NASDAQ OMX Helsinki Stora medier Comptel Dynamic OSS-lösningar gör det möjligt för telekomtjänsteleverantörer att leverera tjänster flexibelt och debitera dem effektivt.|1
Sökandens namn : Jot Automation OY Uppfinnarens namn : Mammila Tuomo , Piirainen Mika och Kellokoski Mika Ansökningsnr : 2424-KOLNP-2008 ADDatum för inlämning av ansökan : 16-06-2008Publiceringsdatum : 300/2001|1
Kesko har cirka 2 000 butiker som bedriver kedjeverksamhet i Norden och Baltikum, Ryssland och Vitryssland.|1
Vid seminariet undertecknades ett samförståndsavtal om samarbete mellan Finska Kemira Company och Vietnam National Chemical Corporation.|2
Talvik säger att omlokaliseringen av applikationsprogram på servrar kommer att fortsätta, medan HP-servrar godkändes på grund av att HP levererar en skräddarsydd lösning till Elisa.|1
Bara i september sjönk marknaden med 10,2 procent på årsbasis till 19,28 miljoner liter.|0
Företaget räknar med att öppna sin första onlinebutik i USA under sommaren 2011.|1
Med denna teckning har Fortums ägande i TGK-10 ökat till drygt 76 % av aktierna och rösterna.|1
Efter omstruktureringen kommer UPM:s genomsnittliga pappersmaskinkapacitet i Europa att vara 320 000 ton (350 000 korta ton) i bestruket journalpapper och 420 000 ton (460 000 korta ton) i bestruket finpapper.|1
Brukets råvarubehov ökar med 100 000 m3 virke.|1
Beställningarna gäller 26 KONE MonoSpace-hissar utan maskinrum, som skulle installeras under 2006.|1
Ett förvärv av TeliaSonera skulle vara France Telecoms största sedan köpet 2000 av Orange plc för 27,8 miljarder (55,1 miljarder USD) och skulle skapa världens fjärde största telekomföretag bakom AT&amp;T Inc., Verizon Communications Inc. och NTT Corp. . av Japan .|1
Ändå noterar Fitch att affärsfundamenten för de tre bankerna för närvarande förblir sunda.|2
Nettoförlusten under samma period 2009 var 18,6 miljoner euro.|1
Den ryska regeringen kommer att bidra med 20 % av de nödvändiga medlen, sade han.|1
Enheterna innehåller också Finnairs egen applikation för att sammanställa kundfeedback och idéer för produktutveckling.|1
Vad tycker vi?|1
Avkastning på sysselsatt kapital ROCE var negativ 2,3 % jämfört med 11,3 % 2007 .|0
Resultat förväntas i slutet av 2006 .|1
ADP News - 13 februari 2009 - Finska återförsäljaren Kesko Oyj HEL: KESBV uppgav idag att dess totala försäljning, exklusive mervärdesskatt moms, uppgick till 661,3 miljoner EUR 853,1 miljoner USD i januari 2009, en minskning med 15,2 % jämfört med föregående år.|0
Satsningen , som kommer att ägas till 51 % av Kemira och 49 % av IVRCL , kommer att driva en anläggning för tillverkning av oorganiska koaguleringsmedel , som ska byggas i Vishakapatnam Vizag i delstaten Andhra Pradesh och starta verksamheten under andra halvan av 2011 .|1
Bevisförhandlingen i Utredningen är planerad till 21 april - 1 maj 2008.|1
Aspocomp har för avsikt att inrätta en anläggning för att tillverka tryckta kretskort med en investering på 310 crore Rs.|1
ALEXANDRIA, Va., 27 augusti - Timo Vataja från Tammerfors, Finland, Virve Inget från Uleåborg, Finland, har utvecklat en datorprogramprodukt med aktivering av nyttjanderätten.|1
&quot; Vi är glada över att välkomna Elisa till vår styrelse , &quot; sa Garry McGuire , VD för RMG Networks .|2
Halonens kansli bekräftade mottagandet av brevet men avböjde kommentarer.|1
Ett annat problem är longdrinkar med colasmak.|1
Ahlstroms 5 800 anställda betjänar kunder via försäljningskontor och produktionsanläggningar i mer än 20 länder på sex kontinenter.|1
En ny Kveyt light-variant av Suomalainen Pekoni som marknadsförs under varumärket Atria är nu tillgänglig för konsumenter i Finland.|2
Ruukkis leverans inkluderar stålkonstruktioner, inklusive installation, för Krakeroy bascule-bro och stålpålar för brofundamenten.|1
Även massaproduktionen i finska Kemij+Ærvi kommer att avvecklas och cirka 1 100 anställda förlorar sina jobb .|0
Antalet A-aktier är oförändrat 9 526 089 aktier.|1
Rörelseförlusten uppgick till 0,8 miljoner euro, jämfört med en vinst på 3,9 miljoner euro året innan.|0
Åtgärderna beror på minskad efterfrågan på teknisk design och produktinformation.|0
Utrustningen kommer att tillverkas vid Vaahtos fabrik i Hollola i Finland och leverans är planerad till första kvartalet 2009.|1
Klockan 12.01 var OMX Helsinki 25 ned 0,66 pct till 3 143,57 och OMX Helsinki var 0,67 pct lägre vid 10 530,74 på en omsättning på 253 miljoner euro.|0
Handelsbanken rankades även denna gång före Lokala andelsbanker och Aktia i kundlojalitet.|2
Med detta kommer företaget att lämna tjänstesegmentet för kontraktstillverkning.|1
Rörelseresultatet före engångsposter var 8,3 miljoner euro under de första nio månaderna 2008, jämfört med 8,4 euro under motsvarande period 2007.|0
Aldata noterade att dess tillvägagångssätt för Voice Supply Chain Technology gör det möjligt för VDW att integrera med lagerhanteringssystem.|1
Den finska operatören Elisa och Aker Yards har tecknat ett långsiktigt serviceavtal genom vilket Elisa kommer att leverera alla nödvändiga röst- och datatjänster för Aker Yards i Finland.|2
Stora vd Jouko Karvinen har beskrivit de ryska tullhöjningarna som ett hot mot framtiden för skogsindustriindustrin i Finland.|0
Koduextra driver en detaljhandelskedja med 11 butiker som kontrolleras av finska Non-Food Center KY, Rukax OY och Scan-Tukka OY.|1
Valutaomvandlingar baseras på växelkurser vid tidpunkten för affären.|1
Kalmar har tilldelats ett nytt 5-årskontrakt för att leverera sin Rough Terrain Container Handler RTCH.|2
Detta är dåliga nyheter för grillsäsongen.|0
Rörelseresultatet minskade dock till nästan 1,7 miljoner euro.|0
Bolaget förhandlade fram en ändring av de finansiella villkoren för nuvarande kreditavtal med hänsyn till situationen den 30 september 2010 .|1
`` Vi var lägstbjudande och nu väntar det slutgiltiga godkännandet. &#39;&#39;|2
Säljare var EOSS Innovationsmanagement och en grupp privatpersoner.|1
Det finska företaget Turun kaupunkin har tilldelat Lemminkainen Talotekniikka Oy kontrakt för elinstallationsarbeten.|2
Etteplan har som mål att sysselsätta minst 20 personer i Borl+Ænge.|2
Konecranes Oyj KCR1V FH föll 5,5 procent till 20,51 euro, den största nedgången sedan juni.|0
Pipelinjen är stark.|2
Kesko har tidigare publicerat ett börsmeddelande om affären den 7 februari 2007.|1
HELSINGFORS (AFX) - Aktierna stängde högre, ledda av Nokia efter att de tillkännagav planer på att samarbeta med Sanyo för att tillverka 3G-telefoner, och av Nokian Tyres efter att dess resultatrapport för fjärde kvartalet slog analytikernas förväntningar, sa återförsäljare.|2
Finnlines har sex fartyg under konstruktion i Kina med leveranser planerade mellan första kvartalet 2011 och sista kvartalet 2012 .|1
Företaget , som sysselsätter 6 400 , rapporterade en nettoomsättning på 620 miljoner euro 823,2 miljoner dollar för 2006 .|1
`` Det finns inget utrymme att ändra delningskomponenten som vi redan har angett. &#39;&#39;|1
Aktieägarens fullständiga namn: Otto Henrik Bernhard Nyberg För ytterligare information kontakta Maija-Liisa Friman, VD, tel. +358 9 7597 0711 .|1
Rörelseförlusten ökade till 17 miljoner euro från en förlust på 10,8 miljoner euro 2005 .|0
&quot;Vi är stolta över att välkomna ytterligare en distributionsanläggning till norra Mississippi och regionen känd som USA:s logistikcenter&quot;, säger Gray Swoope, verkställande direktör för MDA.|2
Företaget sa att det har börjat undersöka effektivisering av sin verksamhet för att möta den hårdnande konkurrensen på marknaden för mobiltelefonladdare.|2
Enligt finska Scanfils grundare och styrelseordförande, Jorma J. Takanen, måste företaget leta efter tillväxt utomlands.|1
Flera stora aktier gick dock ner.|0
1 april 2011 - Finska maskinuthyrningsföretaget Ramirent Oyj HEL : RMR1V meddelade idag att det har förvärvat tillgångarna från sektoraktören Stavebni Doprava a Mechanizace SDM i Tjeckien för en ej avslöjad summa.|1
Under det första kvartalet 2010 var mark-to-market-resultatet en vinst före skatt på 133 miljoner euro jämfört med en förlust på 32 miljoner euro under samma period förra året.|2
Genom att implementera programvaran strävar den finska armén efter att förena och förbättra sin verksamhet inom dessa applikationsområden, uppgav QPR Software.|2
Läkemedel - Spanien Denna helt nya marknadsanalys ger en tydlig överblick över den faktiska situationen och framtidsutsikterna för läkemedelsmarknaden i Spanien.|1
Åtgärderna är resultatet av de lagstadgade samförhandlingarna med anställda som inleddes i februari och gällde all verksamhet i landet.|1
Lemcon undertecknade ett investeringssamarbetsavtal med Kalugas regionförvaltning i november förra året.|2
Ett brett utbud av anslutningsalternativ inklusive 3G-HSPA och Wi-Fi ger konsumenter höghastighetsåtkomst till Internet.|1
Det har inte förekommit tidigare aktieteckningar med 2004 års aktieoptioner.|1
Företaget räknar också med att sälja sina produkter i andra ryska regioner.|2
- Rörelseresultatet ökade med 26,9 % till 105,8 (83,4) miljoner euro.|2
Kershaw tillträder tjänsten med omedelbar verkan från sin tidigare roll som marknadschef för Sankey Home &amp; Garden Products.|1
Den nya organisationen består av två affärsenheter: Charging &amp; Messaging och Finance &amp; Administration.|1
Vi gick till marknaden med en avkastningsguidning på 7,25 %-arean, vilket gav oss flexibiliteten att gå upp eller ner med 1-8:e plats.|1
Den finska tillverkaren av kretskort (PCB) Aspocomp Group Oyj sa den 4 december 2006 att den utnämnde Henry Gilchrist till senior vice president för gruppens asiatiska verksamhet, från och med den 8 januari 2007.|1
Således kommer koncernens balansräkning att ha cirka 25,8 miljoner euro i goodwill för 2010, tillade företaget.|1
Konsumentprodukttillverkaren Fiskars Corp. kommer att öppna ett distributions- och lagercenter i Southaven och skapa 100 jobb.|2
Byggnaden kommer att inrymma produktutvecklings- och testlaboratorier.|1
Finska Benefon förnekar påståenden i pressen att företaget håller på att ge upp sin mobiltelefonverksamhet.|1
Basware erbjuder fullt stöd för alla SAP-versioner från och med SAP 4.5.|1
Iso Omena är baserat i Matinkyla-distriktet i södra delen av staden Esbo, södra Finland.|1
Vinsten före skatt för koncernens livförsäkringsverksamhet ökade till 36 miljoner euro från 27 miljoner euro.|2
Tilläggsordern innehåller bland annat reglerventiler och instrumentering samt komplett fabrikskonstruktion och elektrifiering med Metso drivkontroller.|1
Sponda planerar att renovera gamla fastigheter och utveckla nya fastigheter.|1
Z. Bavellonis mångårige VD, Dino Bavelloni, har gått i pension i slutet av 2005.|1
Samtidigt äger Alfa 25,1 % av MegaFon genom Altimo och 4,99 % av Turkcell via en 18,5 % andel i Cukurova Holding.|1
Seminariet introducerade modern, ren teknik och produkter, finansiella verktyg och sponsringsprogram för energi- och miljöprojekt samt potentialen att utveckla ren energi i Vietnam.|2
Nokia kommer att fortsätta att investera i framtida utveckling av Qt till fördel för alla användare, både kommersiella och LGPL.|2
De belöningar som ska betalas ut på grundval av intjänandeperioden 2011 kommer att motsvara värdet av totalt maximalt 364 000 Componenta Corporation-aktier inklusive den andel som ska betalas kontant.|1
Strömförsörjning, likströmssystem och växelriktare designade och tillverkade av Efore, och system som innehåller dem används i många olika applikationer.|1
Bluewin Security är tillgängligt som ett månadsabonnemang.|1
&quot;Det här är väldigt otäckt&quot;, säger Eric Schultze, teknisk chef på Shavlik Technologies LLC, en St. Paul, Minn.-baserad tillverkare av patchhanteringsverktyg.|0
Fancy Dans på väg FAB Glasgow present- och inredningsbutik Fancy Dans flyttar!|1
Rapala uppskattar att dess nettoomsättning för 2008 kommer att öka med mellan 8,0 procent och 12 procent om man antar 2007 års växelkurser.|2
Koncernen hade en orderbok på 7,74 miljoner euro i slutet av 2007 .|1
Vid stängning var OMX Helsinki 25 0,01 procent lägre till 3 067,64 poäng och OMX Helsinki var nere med 0,05 procent till 10 321,46 poäng på en omsättning på över 1,343 miljarder euro.|0
`` Konsumenterna har mycket väl tagit emot vårt förpackade färska kött.|2
De främre ytorna på dessa ventilplattor är riktade mot varandra.|1
Inom bygg- och inredningshandeln minskade försäljningen med 22,5 % till 201,4 miljoner euro.|0
Nämnda aktieägare har meddelat att de kommer att föreslå bolagsstämman att antalet styrelseledamöter ska vara fem och att förutom nuvarande styrelseledamöter även Lassi Noponen ska väljas in i styrelsen. .|1
Lule+_ kommun har tilldelat YIT ett 2-årigt kontrakt, för fastighetsförvaltning av cirka en tredjedel av kommunens fastigheter, med en total yta på 140 000 kvm.|2
Anläggningen kommer att ha en uthyrningsbar yta på cirka 19 000 kvm. Tomten till anläggningen, belägen i Ratasmakis företagspark, kommer att köpas av Forssa stad.|1
CF2 Pty Ltd blev en betydande ägare i Renison Consolidated Mines NL den 25 januari med 150 miljoner aktier (7,9 pct.).|1
Resultatet före skatt minskade med 37 % till 193,1 miljoner euro från 305,6 miljoner euro.|0
Det finska skogsföretaget UPM-Kymmene och avfallshanteringsföretaget Lassila &amp; Tikanoja sa den 30 januari att de planerar att producera etanol och energi från kommersiellt och industriellt avfall.|1
Höljet innefattar ett första sidohuselement försett med det första sidotrågssegmentet och ett andra sidohöljeselement försett med det andra sidotrågsegmentet, varvid åtminstone det första sidohöljeselementet är svängbart kring en rotationsaxel.|1
Rörelseresultatet steg till 1,6 miljoner euro från 1,1 miljoner euro motsvarande period 2006 .|2
Som en del av transaktionen har M-real och Sappi även tecknat ett långsiktigt avtal om leverans av massa och BCTMP och andra mindre tjänster och leveranser.|2
EA Reng-gruppen omsatte cirka 84 miljoner kronor för 2007.|1
Denna nya affär har stärkt partnerskapet från Telemig Celular och Tecnomen, som det har startat sedan Telemigs förbetalda verksamhet började.|2
Finska Ahlstrom Corporation har beställt nyckelproduktionsutrustning för en ny produktionslinje för fiberduk av glas vid sitt ryska bruk i Tver från finska Vaahto Pulp &amp; Paper Machinery (som är en del av Vaahto Group).|2
M-real Corporation Pressmeddelande den 3 november kl. 10:35 M-real Corporation var det näst bästa företaget i materialsektorn inklusive t.ex. skogsindustriföretag i Carbon Disclosure Leadership Index CDLI, Nordic Report 2009.|2
Tidigare har bolaget beräknat sitt rörelseresultat till att bara nå nivån 2005 .|2
KONE är noterat på den nordiska börsen i Helsingfors.|1
Ahlstrom, med huvudkontor i Helsingfors, Finland, är en global ledare inom utveckling, tillverkning och marknadsföring av högpresterande fiberbaserade material.|1
Det treåriga turn-around-programmet förväntas säkerställa Salomons framtida konkurrenskraft, sade företaget.|2
I Baltikum förväntas sammanslagningen av de två verksamheterna vara slutförd i början av 2008.|1
I det totala servicekonceptet ingår även tekniktjänster, med vilka Raute stödjer sina kunder under hela livscykeln för sina investeringar.|1
GUANGDONG , 26 oktober , SinoCast -- Nokia Telecommunications filial i Dongguan ingick en avsiktsförklaring om att öppna en Nokia - klass i Qingyuan yrkeshögskola , staden Qingyuan i Guangdongprovinsen .|1
Investeringen skulle vara cirka 5 miljoner euro.|1
Tekla Structures 16-installationen har byggts enligt Microsofts krav för Windows 7-certifieringen, tillade företaget.|1
Intäkterna ökade samtidigt med 14 procent till 43 miljoner euro.|2
USA:s regering, främsta bränsleleverantör arbetar för att säkra rörledningar när stängningen börjar på fjärde dagen|1
POYRY PLC Ytterligare information av: Martin Kuzaj, VD, Industry Business Group, Finland Tel. +358 10 33 21179 Sanna Paivaniemi , direktör , Investor Relations , Poyry PLC , Finland Tel. +358 10 33 23002 Poyry är ett globalt konsult- och ingenjörsföretag dedikerat till balanserad hållbarhet.|1
Pengarna kommer främst att fördelas över 2011 och 2012, sa företaget.|1
För att uppnå synergimål relaterade till förvärvet konsoliderar Vaisala sina tillverknings-, depå- och datatjänster samt finansieringsaktiviteter som för närvarande finns i Uniontown, Pennsylvania, St. Louis, Missouri och Durham, North Carolina.|1
Aho är stolt över företagets nya produkt, Lordi-Cola.|1
Övriga aktieägarrättigheter trädde i kraft idag.|1
`` Leipurin är en växande och snabbt internationaliserande koncern.|2
Vinsten före skatt minskade till 31,6 miljoner euro från 50,0 miljoner euro året innan.|0
under Q1 &#39;10 19 april 2010 - Den finska skogsmaskins- och utrustningstillverkaren Ponsse Oyj HEL: PON1V sa idag att de förväntar sig att svänga till en nettovinst på cirka 6,3 miljoner euro under första kvartalet 2010, från en förlust på 9,6 miljoner euro ett år tidigare.|2
OMX Nordic 40 OMXN40 - index , som omfattar de 40 mest omsatta nordiska aktierna på Nasdaq OMX - börsen , stängde ned 0,87 % på 1 064,14 punkter på torsdagen .|0
