sentence_column_name|tag_column_name
Enligt rapporten är Elisas och DNA:s gemensamma marknadsandel av den finska telekommarknaden 59 %.|1
`` Tom Doring har en lång och framgångsrik karriär inom drevbranschen och han känner till den amerikanska marknaden.|1
Sanoma Magazines Finlands omsättning ökade till 140,1 miljoner euro från 131,8 miljoner euro.|2
Rörelseresultatet för 12-månadersperioden minskade från 9 ,6 miljoner euro medan nettoomsättningen ökade från 69 ,0 miljoner euro jämfört med 2005 .|1
`` Marimekko verkar i en bransch där förändringar i företagsklimatet återspeglas i konsumenternas efterfrågan.|1
Under strejken beräknar Finnair att drabbas av en nettoförlust på mellan 2 miljoner euro och 2,5 miljoner euro per dag.|0
Nokia-telefoner som stöds inkluderar: N96 , N95-8GB , N95 , N93-N931 , N92 , N85 , N82 , N81 , N80 , N79 , N78 , N77 , N76 , N75 , N73 , N72 , E 7, E 7, E 7, E 6 , E65 , E62 , E61-E61i , E60 , E51 , E50 , Touch Xpress 5800 , 6220 Classic , 6210 Navigator , 6120 Classic , 6110 Navigator , 5700 , 5500X , 5.|1
Nokia noterade också att det genomsnittliga försäljningspriset för mobiltelefoner sjönk under perioden, även om dess vinstmarginal för mobiltelefoner ökade till mer än 22 procent från 13 procent under föregående kvartal.|2
Den globala sportutrustningstillverkaren Amer Sports Corp., vars varumärken inkluderar Atomic, Salomon och Wilson, såg en 64-procentig ökning av nettovinsten för tredje kvartalet till 47,4 miljoner USD 65 miljoner euro på grund av starka försäljningar och kostnadsminskningar.|2
KAUKO-TELKO LTD PRESSMEDDELANDE 19.06.2007 KL 14.00 1 ( 1 ) Telko Group ( Kauko-Telko ) utökar sitt strategiska partnerskap med BP Industrial Lubricants &amp; Services ( BP ILS ) genom att förvärva totalägandet av BP : s svenska detaljhandelsbolag Molub . -Alloy AB .|2
SysOpen Digia hade tecknat avtal med Senteras huvudägare som innehar totalt 77,39 % av aktiekapitalet och rösterna i Sentera.|2
Vätskehanteringsprodukter inkluderar elektroniska och mekaniska pipetter, engångsspetsar samt pipettunderhåll och kalibreringstjänster för forskningsinstitutioner, sjukvård och industrilaboratorier.|1
När webbanvändaren klickar på länken i e-postmeddelandet hamnar han på en falsk sida som imiterar hans banks och som hämtar hans personliga bankuppgifter.|0
Förvärvet av Boomeranger Boats Oy är i linje med Done Solutions strategi att utveckla sin verksamhet genom företagsförvärv.|2
&quot; Dessa tester är en del av en större kampanj som inkluderar olika kundförsök och demonstrationer för att göra LTE på 800 MHz kommersiellt gångbar till sommaren , &quot; sa Nokia Siemens chef för LTE - affärslinjen , Reino Tammela .|1
Försäljningen kommer att resultera i en kapitalförlust på 5 miljoner euro för Solidium , som fick aktier i Tikkurila i mars 2010 .|0
Den finska fiber- och plastprodukttillverkaren Suominen Corporation sa att dess nettoförlust minskade till 1,6 miljoner euro 2,0 miljoner euro under de första nio månaderna 2006 från 2,16 miljoner euro 2,7 miljoner euro under samma period 2005.|2
Verksamheten sträcker sig från utveckling av naturresurser till detaljhandelsmarknadsföring av färdiga produkter.|1
Förvärvet förväntas förbättra tillgången till krommalmsresurser i Turkiet.|2
Både rörelseresultatet och omsättningen för sexmånadersperioden ökade från 17 ,6 miljoner euro respektive 1 149 ,9 miljoner euro jämfört med motsvarande period 2007 .|2
Affären är i linje med Etteplans strategi att verka som partner till globala kunder och tillhandahålla industriella tekniska designtjänster.|1
TeliaSoneras dotterbolag, mobiloperatören EMT i Estland, har skapat världens första mobila identifieringstjänst som gör det möjligt att rösta via en mobiltelefon.|1
(En talesperson sa till WWD att förvänta sig en blandning på 50-50 av kläder och heminredning.)|1
zip , &quot; varnade experter på tisdag .|1
Finnlines sa att affären är en del av dess strategi att fokusera på sina kärnverksamheter.|1
Technopolis har avsatt en tomt på 4,6 hektar för att bygga parken, sa Mikkonen.|1
Salcomp Manufacturing Oy kommer att betala 35 miljoner euro kontant till Salcomp i samband med genomförandet av försäljningen och överlåtelsen av verksamheten.|1
De 718 430 nya A-aktierna kommer att bli föremål för handel på Helsingfors Börs Huvudlista, tillsammans med de gamla A-aktierna, den 3 juli 2006.|1
Den finskägda kontraktstillverkaren av elektronik Elcoteq Hungary Kft har tillkännagivit planer på att rekrytera mer än 650 nya medarbetare för att fullfölja nya beställningar inom P+_cs, där företaget har två fabriker.|2
Dessa inkluderar mjukvaruutveckling för internet- och mobiltelefoninnehåll, kommunikation, mervärdesprogramvara, finansiella tjänster, säkerhetsapplikationer, systemintegration och elektronik.|1
Juhani J+Ærvi, koncernchef för Kesko, säger att den ryska livsmedelssektorn är fragmenterad.|1
Cramo, med huvudkontor i Vanda, Finland, hyr entreprenadmaskiner och utrustning, samt hyr ut och säljer modulutrymmen.|1
Den finska leverantören av lösningar för metallindustrin Outotec Oyj ökade till 50,4 miljoner euro (72,5 miljoner USD) för de första nio månaderna 2007 från 20,1 miljoner euro (28,9 miljoner USD) för samma period 2006.|2
Under 2005 redovisade banken en nettovinst på 8,2 miljoner Lt.|1
LONDON MarketWatch -- Aktiekurserna slutade lägre i London i måndags då en återhämtning i bankaktier misslyckades med att kompensera för en bredare svaghet för FTSE 100 .|0
Enligt Tiimari rekommenderas konsumenter att klippa bort kaninflugan som innehåller formadehyden och kassera den.|1
Ämnet för projektet är att tillhandahålla företaget som: Programvaruprogrammering och konsulttjänster, datorrelaterade tjänster, datatjänster, datorstöd och konsulttjänster, internettjänster etc.|1
Sammantaget var 50 procent av de tillfrågade säkra på sin säkerhet när de bankar online.|2
Företaget betjänar kunder inom olika branscher, inklusive process och resurser, industrimaskiner, arkitektur, byggnad, konstruktion, el, transport, elektronik, kemi, petrokemi, energi och informationsteknik, samt catering och hushåll.|1
Pressmeddelande 3 september 2009 Ruukki fortsätter att vara listad i två Dow Jones Sustainability Index: DJSI World och DJSI STOXX.|1
Bidens plan för elfordon inkluderar batteriåtervinning|1
Nordea var billigast även för ett par i 30-årsåldern med skulder.|1
Den finska affärsmjukvarukoncernen AffectoGenimap Oyj sa att dess nettovinst halverades till 1,2 miljoner euro (1,5 miljoner USD) under de första nio månaderna 2006 från 2,2 miljoner euro (2,8 miljoner USD) under samma period 2005.|0
Köpesumman är cirka 10 miljoner EUR 12,97 miljoner USD.|1
Karachi, 14 september – Ixonos, världsledande inom utveckling och integration av lösningar för handhållna enheter, tillkännagav att de implementerar en mobilanvändargränssnittslösning med pekskärm för Intel Atom-processorn Z6xx-baserade smartphones.|1
Under 2008 genererade den en nettoomsättning på 9,3 miljoner EUR 13,1 miljoner USD.|1
Hamnoperatören förespråkar dock att hamnavgifterna behålls 2010, med hänvisning till ägaren, Estlands regering, och förbinder hamnen att betala 400 miljoner EEK (25,56 miljoner USD 36,44 miljoner USD) i utdelning till staten 2009 och ytterligare 300 miljoner EEK under 2009. 2010 .|1
Dessutom kan ytterligare 29 anställda sägas upp tillsvidare och hela personalstyrkan kan sägas upp under kortare perioder vid behov.|0
Kesko följer en sund och fokuserad tillväxtstrategi med fokus på försäljning och tjänster till konsumentkunder.|2
Boomeranger Boats Oy är specialiserat på båtbygge och designar, tillverkar och säljer skräddarsydda Rigid Inflatable Boats RIB främst för Östersjömarknaden.|1
Jawad Williams gjorde 23 poäng i en imponerande debut för Jerusalem, med Jason Rich som lade till 18 och Yuval Naimi chippade in med 16 poäng för Hapoel, som besöker de gul-blå nästa vecka.|2
&quot;Jag försöker hantera slaveri från ett annat perspektiv för att balansera historien&quot;, säger DeRamus, tidigare författare på Detroit Free Press och Detroit News.|1
Bolagets marknadsandel fortsätter att öka ytterligare.|2
Våra lösningar är branschoberoende och stödjer flerspråkiga behov och valutabehov, modulära och tillämpliga på företag av alla storlekar, sa vd Ilkka Sihvo.|1
Arbetsmarknaden riskerar att bli långvarig &quot;ärrbildning&quot; från pandemi.|0
Som ett resultat av förhandlingarna skulle anställningen av 130 arbetare vid Uleåborgsfabriken avslutas.|0
Det gemensamma företaget kommer genast att investera cirka 500 000 euro i produktionsteknik.|1
Elförbrukningen växer med högre frekvenser.|1
Genom att minska antalet anläggningar kommer koncernen att minska de fasta kostnaderna.|2
Utrustningen Ixonos förvärvar med denna affär inkluderar maskinvara ; ett laboratorium för RF och antennmätning; utrustning för mätning av ljud, kameror och bildskärmar; samt enheter och robotenheter för testning av mobila enheter.|1
Nettoomsättningen 2008 förväntas ligga på samma nivå som 2007 .|1
Finska Outokumpu Technology har tilldelats flera nya slipteknikkontrakt.|2
Avtalet måste godkännas av de ryska konkurrensmyndigheterna innan det träder i kraft.|1
Vi är nu i en position att söka nya kliniska kandidater framöver. &#39;&#39;|2
Företaget sa att 80 % av aktierna i holdingbolaget kommer att säljas till Meadville Holdings Limited, ett Hong Kong-noterat moderbolag till Meadville Group.|1
Företaget hade en omsättning på 10,8 miljoner euro 2008 och har idag cirka 120 anställda i Finland, Estland och Polen.|1
Mr Ashley, vice verkställande ordförande för Sports Direct, sålde en andel på 43 procent i företaget för mer än 900 miljoner pund vid tidpunkten för flyttningen.|1
Vianor säljer däck för personbilar och lastbilar samt en rad andra bildelar och tillhandahåller underhållstjänster.|1
Finska Rautaruukkis ingenjörsavdelning Ruukki Engineering kommer att omorganisera sin verksamhet i Mo i Rana-fabriken i Norge.|1
I januari-augusti 2009 sjönk importen till sjöss i container-, lastbils- och trailerenheter med 27,7 % och exporten med 28,6 % från motsvarande period 2008.|0
Dieselmarginalen har varit fortsatt hög.|2
Land : , Schweiz Sektor : Läkemedel Mål : Synosia Therapeutics Holding AG Köpare : Biotie Therapies Corp Affärsstorlek i USD : 129,4 m Typ : Företagsförvärv Finansiering : Hela lager Status : Stängd|1
Teollisuuden Voima Oyj, det finska bolaget TVO, sa att det nominerade Mitsubishi Heavy:s EU-APWR-modell tillsammans med reaktorer från Areva, Toshiba Corp., GE Hitachi Nuclear Energy och Korea Hydro &amp; Nuclear Power Co.|1
STOCKMANN Abp BOLAGSMEDDELANDE 20.2.2007, kl. 13.40 En årsöversikt över Stockmanns börs- och finansiella pressmeddelanden 2006 finns tillgänglig på bolagets webbplats på adressen www.stockmann.com.|1
Incap Corporation Börsmeddelande 4 maj 2010 kl. 8.30 INCAP CORPORATIONS RIKTADE EMISSION TECKNADES HELT Styrelsen för Incap Corporation har godkänt teckningen av riktad aktieemission.|1
Trafiken i Europa ökade med nästan 30 %.|2
Som en del av sin nya strategi planerar finska Biohit att införliva sin diagnostikverksamhet i ett separat aktiebolag.|1
Produktionen av kontrakten uppgår till 72 MWe.|1
ALEXANDRIA, Va., 6 oktober - USA-patent nr. 7 804 288 , utfärdat den 28 september , tilldelades Vacon Oyj ( Vasa , Finland ) .|1
Intäkterna ökade med 1 procent till 742,2 miljoner euro från 735 miljoner euro 964 miljoner USD.|2
Kassaflödet från verksamheten under januari-december 2008 var negativt 18,1 miljoner euro jämfört med 39,0 miljoner euro under motsvarande period 2007 .|0
Varför inte prenumerera på tidningen?|1
TomTom har försäkrat att de kommer att fortsätta att sälja kartor till konkurrenter om de vinner EU - godkännande .|2
Rinkuskiais ölförsäljning sjönk med 6,5 procent till 4,16 miljoner liter, medan Kauno Alus ölförsäljning ökade med 6,9 procent till 2,48 miljoner liter.|1
Nokian Capacitors utrustning kommer att användas för att öka kapaciteten och tillförlitligheten hos det indiska nätet.|2
Jukka Hienonen, Finnairs nuvarande vd, kommer att avgå i slutet av januari 2010.|1
Förlusten för tredje kvartalet 2007 var 0,3 miljoner euro mindre än förlusten för andra kvartalet 2007 .|2
Kone sa i domstolspapper att den fackliga åtgärden försenade reparationer av hissar vid det federala domstolshuset den 21 januari och Saltonstalls statliga kontorsbyggnad den 23 januari.|0
Försäljningen ökade med 10 procent till 566 miljoner euro på grund av starka volymer och gynnsamma valutaeffekter.|2
Tekla kommer att implementera förnyelsen i mjukvaruversioner som kommer att introduceras under våren 2011.|2
Resultatet för tredje kvartalet inkluderar också en avsättning på 400 000 euro (575 000 USD) för neddragning av betenstillverkningen i Irland.|1
Scanfils innehav inkluderar 100 % av kontraktselektroniktillverkaren Scanfil EMS Group.|1
Gruppen har för avsikt att flytta lager- och kontorslokaler i Loudeac och Saint Marcel till Morvillars, i östra delen av landet, där den redan driver en enhet för tillverkning och distribution av krok.|1
Affärsutvecklingsinitiativen i Nordamerika leds av Lynn Shanahan.|1
Det finska tjänsteföretaget för elektroniktillverkning Elcoteq tecknar ett samarbetsavtal med en japansk mobiltelefontillverkare går förbi Elcoteq Tallinn, säger Jan Kotka, VD för Elcoteq Tallinn.|2
Tyson Foods lanserar växtbaserad mat i Asien-Stillahavsområdet|1
Övningen har sitt ursprung i Finland i början av 1930-talet som en träningsmetod för längdskidåkare.|1
Priset på obligationerna på 10 000 kroons nominella värde var 9663,51 kroon i den primära emissionen.|1
Försäljningen, som kommer att resultera i en vinst på cirka 60 miljoner euro under andra kvartalet 2010 för Oriola-KD, stödjer det finska företagets strategi att fokusera på läkemedelsgrossist- och detaljhandelsverksamhet.|2
Dessutom kommer den kazakiska delegationen att besöka Finlands investeringsfond SITRA , Honkarakenne Ltd och Nokias huvudkontor för att studera TeliaSonera Ltd JSC : s verksamhet .|1
Företaget har ett kontinuerligt behov av legeringar som nickel, ferrokrom, molybden och mangan i sin produktion, säger Talvivaara.|1
Bolagets aktie är noterad på NASDAQ OMX Helsinki Rautaruukki Oyj: RTRKS.|1
Det totala beloppet av teckningskurser registrerades i fonden för investerat fritt eget kapital .|1
Herr KR Vasantha har utsetts till verkställande direktör för Incap Contract Manufacturing Services Pvt. Ltd. .|1
De nya B-aktierna medför rätt till utdelning och andra aktieägarrättigheter från och med idag.|1
Enligt det lettiska företagsregistret stängde Uponor Lettland i rött med LVL 99 000 EUR 139 538,17 USD 194 556,48 på en omsättning på 2 346 miljoner LVL för 2009 .|0
YIT förvärvade investeringsrättigheter till ett 10 000 kvadratmeter stort bostadsprojekt i Yaroslavl och till ett 16 400 kvadratmeter stort projekt i Moskva.|1
Ramirent Finland är den inhemska enheten för maskinuthyrningsföretaget Ramirent Oyj HEL: RMR1V.|1
` Investeringen i Matka-Vekka har varit rimlig för investerare i CapMan-fonder. &#39;|1
&quot;Det är en mycket hög siffra på europeisk skala,&quot; sa Noop och påminde sig dock om att detta även inkluderar öl köpt av finska turister.|1
Företaget vände sig till en vinst per aktie ( EPS ) på 0,03 EUR mot förlust per aktie på 0,01 EUR .|2
Divisionen omfattar även gemensamma försäljnings-, marknadsförings- och kontrollfunktioner för dessa enheter.|1
Dessa kommer delvis att kompenseras av en vinst på 186 miljoner euro på försäljningen av Celbi-massafabriken i Portugal.|2
HELSINGFORS ( Thomson Financial ) - Kone sa att de har vunnit fyra order i Saudiarabien , Förenade Arabemiraten och Qatar värda 40 miljoner euro .|2
Att påbörja byggarbetena av Pearl Plaza är ett viktigt steg i våra ryska projekt.|2
Att vara nummer ett innebär att skapa mervärde för intressenter i allt vi gör.|1
Enligt finska FIM Bank skulle Alpros pris vara omkring 100-150 miljoner euro.|1
De mest lojala kunderna återfanns i Bank of +_land med ett index på 8,0.|2
MANAVIGATOR-7 september 2010-Kemira avslöjar indiskt JV med IVRCL Den finska kemikaliegruppen Kemira (HEL: KRA1V) meddelade på tisdagen att de har ingått ett avtal om att bilda ett joint venture i Indien med det lokala byggföretaget IVRCL Infrastructure and Projects Ltd (BOM:530773) ) .|2
Som ett resultat av detta skulle totalt 82 anställda sägas upp.|1
Inom bygg- och heminredningsbranschen uppgick omsättningen till 1 173 miljoner euro, en minskning från 1 566 miljoner euro ett år tidigare.|0
Räntenettot ökade med 4,5 % till 31,4 miljoner euro från 30,0 miljoner euro 2004 .|2
Volymmässigt ligger fokus redan utanför Finland, eftersom 60 % av koncernens produkter tillverkas i Polen och de baltiska länderna.|1
Den rapporterade rörelsemarginalen var -5,9 %.|0
Rekryteringen är relaterad till flyttningen av Stora Ensos forskningsverksamhet till Karlstad i Mellansverige.|1
Koistinen kommer från Nokia Siemens Networks där han har haft olika ledande befattningar inom försäljningsledning och affärsutveckling sedan 1997.|1
Flygbolaget har beställt nio Airbus A350-900 flygplan med leveranser från 2011 och blir därmed det ledande flygbolaget för den senaste varianten av Rolls-Royce Trent-seriens motorer, kallad 1700.|2
Ruukki Romania, den finska metallproducenten Ruukkis lokala arm, ökade sitt kapital med 900 000 euro (1,14 miljoner USD) genom kontantinsats, rapporterades den 19 september 2006.|2
Säljare är finska Elcoteq Group, det största europeiska tjänsteföretaget för elektroniktillverkning.|1
Okmetics styrelse har även beslutat om ett nytt aktieägarprogram riktat till bolagets högsta ledning.|1
Den finska plaströrstillverkaren Uponor säljer sina irländska och brittiska infrastrukturverksamheter till private equity-bolaget 3i.|1
Bruttoarean på åtta hus blir 12 167 m2.|1
Protalix har 42 miljoner dollar i kontanter och ingen försäljning.|1
Hur Modis fyllda relation med pandemidata har skadat Indien.|0
Enligt Barclays kommer F-Secure-programvaran att skydda användare från hackare, virus, spionprogram och andra digitala attacker.|1
Swisscom vänder sig till AWS för företags-IT, 5G-kärna på molnet|1
Den 20 mars 2006 vägrade Stora Enso att kommentera nyheterna på något sätt.|1
Den totala investeringen som krävs kommer att uppgå till 40 miljoner euro, uppskattade företaget.|1
Finska koncernen för uthyrning av anläggningsmaskiner och utrustning Cramo Oyj meddelade den 21 mars 2007 att dess svenska dotterbolag Cramo AB kommer att sälja sitt holländska dotterbolag Cramo Nederland BV (CNL) till det holländska uthyrnings- och ställningsföretaget Jaston Groep BV för en ej avslöjad summa.|1
Företaget sa att efterfrågan på papper ökade på alla dess huvudmarknader, inklusive publikationspapper, och att de ökade de genomsnittliga papperspriserna med 4 procent jämfört med förra året.|2
Neste oils styrelse föreslog 1,00 euro i utdelning för helåret 2007, jämfört med 0,90 euro för ett år sedan.|2
Finska banken Alandsbanken sa på måndagen att den kommer att köpa den svenska verksamheten av Islands oroliga Kaupthing Bank för 414 miljoner kronor 49,5 miljoner dollar i kontanter.|1
Rekommendationen &quot; köp &quot; upprepades .|2
Lastbilarna har ett Eco Drive-system - ett bränslemätverktyg som lagrar data för individuella förare.|1
Vinst per aktie ( EPS ) efter utspädning steg till 1,05 EUR från 0,64 EUR .|2
Denna organisation kommer att ta på sig ansvaret för verksamheten i Ryssland.|1
De viktigaste utmanarna på marknaden är Logset och Sampo-Rosenlew.|1
( ADP News ) - 3 november 2008 - Det finska pappers-, förpacknings- och skogsproduktföretaget Stora Enso Oyj ( OMX : STERV ) sa idag att det skulle investera 137 miljoner euro ( 176,6 miljoner USD ) i byggandet av ett kraftverk vid dess Ostroleka Mi|1
Tieto i Lettland representeras av IT-tjänsteföretagen TietoEnator Alise och TietoEnator, som har verksamhet inom branscherna Financial Services Cards, Retail and Logistics och IT Outsourcing and Managed Services.|1
Vuokatti-enheten kommer att utvecklas för att fokusera särskilt på tillverkning av prototyper, upptrappning av nya produkter och krävande test- och eftermarknadstjänster.|1
Ahlstroms aktie är noterad på NASDAQ OMX Helsinki.|1
Cirka 250 av dessa minskningar kommer att genomföras genom pensionsarrangemang.|1
The Point Village, designad av Scott Tallon Walker, kommer att innehålla ett köpcentrum, kontorslokaler, ett hotell och en biograf.|1
Då kapaciteten minskade med 1,4 % minskade kabinfaktorn med 7,8 procentenheter.|0
Tekes beslut baserades bland annat på följande skäl: projektet har en betydande inverkan på företagets affärsutveckling.|1
Det fasta bränslet värms upp innan slam blandas däri. &#39;&#39;|1
Det korrigerade kapitlet finns i sin helhet nedan.|1
Den håller också på att ta plats i CapMans styrelse - en kurs som har stöd av CapMans ledning.|1
Rapporten innehåller företags- och varumärkesandel på kategorinivå samt information om distributionsandelar för 2007 och 2008.|1
Den totala golvytan för anläggningsexpansionen är 29 000 kvadratmeter.|1
Både rörelseresultatet och omsättningen för tremånadersperioden ökade, från 0,3 MEUR respektive 13,1 MEUR, jämfört med motsvarande period 2005.|2
E7-smarttelefonen kommer att finnas tillgänglig för 35 000 Rs 000 per telefon i hela Indien, säger Nokias Indiens vicepresident och verkställande direktör D Shivakumar till reportrar.|1
CORPORATE IT UPDATE - ( C ) 1995-2009 M2 COMMUNICATIONS LTD Finska teknologikoncernen Teleste Corporation ( OMX Helsinki : TLT1V ) rapporterade onsdagen ( 4 februari ) ett rörelseresultat på 5,6 miljoner euro på en nettoomsättning på 108 ,7 miljoner euro för året 2008 .|1
Goodwill och andra immateriella tillgångar står för cirka 2,0 miljoner euro (2,6 miljoner USD) av köpeskillingen, varav 20 procent betalas i Aspo-aktier.|1
Affären, som redan godkänts av aktieägarna, kommer att genomföras under första halvåret 2011.|1
Alla Amer Sports företag utvecklar och tillverkar tekniskt avancerade produkter som förbättrar prestandan för aktiva sportdeltagare.|1
Luftfartsverket beslutade att tillfälligt återöppna huvudstadens Helsingfors flygplats från 15.00 till 23.00 måndag lokal tid.|1
Han är styrelseledamot i ett flertal bolag och aktieägare i Boardman Ltds styrelsespecialistnätverk.|1
+_lemiste City är miljön för en kunskapsbaserad ekonomi som ger arbete åt 3 300 personer med den totala omsättningen för dess företag som uppgår till 5,4 miljarder EEK, säger +_lo P+Ærnits, ordförande för förvaltningsrådet för +_lemiste City och Mainor .|1
Lufttrafiken i Finland har stått stilla sedan dess.|0
Dess marknadsandel minskade dock till 47,59 procent från 48 procent ett år tidigare.|0
När dina växter väl är i marken kommer de att fortsätta växa, men framgången för alla trädgårdar ligger i hur väl den underhålls.|1
Wartsila vann kontraktet i oktober 2007 och anläggningen kommer att installeras i Manturovo i Kostroma-regionen i Ryssland, cirka 600 km nordost om Moskva, Ryssland.|2
Atria Group är en ledande skandinavisk köttvarukoncern.|2
Förvärvet av +_landsbanken Sverige 2009 belastade resultatet med 3,0 miljoner euro.|0
De viktigaste investeringsposterna var i det globala ERP-projektet för affärsresursplanering, produktutveckling och produktionsmaskiner.|1
Omkring 50 procent av världens ro-ro-flotta är över 25 år och måste skrotas av miljöskäl.|1
Ett filter används för att förbehandla paket för att avgöra om de behöver bearbetas ytterligare av nätverksenhetens processor.|1
UPM-Kymmene har genererat trettioen kvartal i rad med positiv EBITDA.|2
Enligt lagen kan universitet nu skaffa privat finansiering.|1
En taleskvinna för det italienska modehuset avböjde att kommentera uppgörelsen.|1
Ståltillverkaren sa att vinstminskningen förklaras av den fortsatta ekonomiska osäkerheten, blandad med den nuvarande torkan i bankutlåningen, vilket resulterar i en minskad efterfrågan på dess produkter eftersom kunderna får allt svårare att finansiera verksamheten.|0
Iggesunds Bruk i Sverige är ett av de mest avancerade, helintegrerade massa- och kartongbruken i världen.|2
Vår djupa expertis sträcker sig till områdena energi, industri, stad &amp; mobilitet och vatten &amp; miljö.|1
EBIT exklusive poster av engångskaraktär uppgick till 67,8 miljoner euro, en ökning från 38,1 miljoner euro.|2
`` NTC har en geografisk närvaro som kompletterar Ramirents befintliga nätverk och för oss närmare våra kunder i östra Böhmen i Tjeckien. &#39;&#39;|2
Det är överenskommet med bolagets styrelse att hon ska vara tillgänglig i en rådgivande roll.|1
Verksamheten omsätter cirka ( Euro ) 35 miljoner ( 44 miljoner USD ) och har ansvarat för försäljning och marknadsföring av Lanxess &#39; papperskemikalier , som Kemira köpte för ( Euro ) 88 miljoner i början av året ( CW , 11 januari ) , sid. 22).|1
VDW kombinerat med LXE-enheter ökar produktiviteten, vilket gör det möjligt för arbetare att använda en enda enhet för att utföra röst-, skannings- och tangentbordsfunktioner.|2
&quot; Vi hoppas kunna förtydliga vår policy för finska företag där det finns gråzoner , &quot; sa Motlanthe .|1
Tornet som man valde att lägga till, som ska tas i drift under sommaren, kommer att öka den totala kapaciteten till 80 broadsheet eller 160 tabloidsidor, med möjlighet att köra 32- och 48-sidors produkter sida vid sida.|2
